0,subjectivity,1
"The Democratic party is comfortable talking about the issue and well positioned to address it. In some ways, the current debacle seems to vindicate their failed efforts of the early 1990s. Moreover, the party is by far the more trusted in this area: In the last Wall Street Journal/NBC poll on issues, Americans choose Democrats on health care over Republicans by a 37-percent margin (the largest gap on any issue, save global warming). Which is why Barack Obama  and every other Democrat "" is talking about health care again.""",SUBJ,0_0
"In her sworn testimony, Dr. Curry stated, The information cascade of climate change as apocalypse is impeding our ability to think rationally about how we should respond to climate change.",SUBJ,5_2
"Date: April 3, 2010 Time: 10:00 am Central DST To Listen: Visit our BlogTalkRadio Page Call 646-727-3170 to ask a question. /p>",SUBJ,0_0
"The result of falling emissions has been a general improvement in air quality in nearly all major urban areas of the country. Between 1987-1992 and 1994-1999, for example, the number of bad air days"" (when air quality failed to meet federal standards) fell 82 percent in Newark, 54 percent in Los Angeles, 78 percent in Chicago, and 69 percent in Milwaukee.13""",OBJ,0_0
"More importantly, the real issue in Mass v. EPA was not, as petitioners and the majority argued, whetherCAASec. 302(g) could be interpreted (or tortured) to justify regulating GHG emissions from one subset of mobile sources (new motor vehicles) under one provision of the Act(CAA Sec. 202).The real issue, rather, waswhether Congress, when it enacted and amended CAA Sec. 202 in 1970 and 1977,authorized EPA to implement a Super-Kyoto regime under the CAA as a whole . To state this question, is to answer it. Sadly, that question was never squarely before the Court.",SUBJ,0_0
"Looking ahead, the Clear Skies Initiative"" announced by the Bush administration would require cuts in power plant emissions of what EPA calls ""the three worst air pollutants"" by roughly 70 percent.16 According to EPA, the Clear Skies Initiative would:""",OBJ,0_0
A nice post by Lucia on why the data matters and why the ridiculous RC response page is a good start yet completely inadequate to fix the problems.,SUBJ,0_0
"Precaution, however, can also be taken to far. This year I've noticed that, as local flooding occurs every year, the weather forecasters, and especially the media reporting the risks are beginning to irritate some people with their precautionary principle. The fact that some areas are hit more easily (and they can easily be identified) does not call for a warning against an entire region. Still, that is what is being done. The result is that the tourist industry, and then not whatever local attraction there is, but also hotels, restaurants, cafes and other business are severely hurt, sometimes into the next season, when even booked parties cancel. Most of these businesses get almost all of their revenue during three months every year. No business this year, might very well mean no business next year too. And this often in perfectly safe areas with unaffected infrastructure.",SUBJ,0_0
"But the abstract of Lee and McPhaden reads, Therefore, the welldocumented warming trend of the warm pool in the CP region is primarily a result of more intense El Nio events rather than a general rise of background SST. This contradicts the earlier studies with theoretically predicted change of the background SST under global warming scenarios.",OBJ,5_1
"Satellite measurements (Wielicki et. al. 2002, Evidence of large decadal variability in the tropical mean radiative energy budget. Science Vol 295, pg841) suggest that, at least over the tropics, longwave emission to space increased over the period 1985-1999, contrary to what would be expected from anthropogenic greenhouse radiative forcing.",SUBJ,2_3
"The majority of the Mandurah to Fremantle sector does not appear to be susceptible to coastal erosion over the next century, despite the fact that the Tamala Limestone is preserved below sea level across the majority of the area. This is due to the fact that this sector has been the primary depositional province for the Swan coast over the last 8,000 years.",OBJ,0_0
"CEI Response: Davis found a net ice balance increase of 1.4cm/yr over his entire region of coverage (ROC). The East Antarctic Ice Sheet is gaining at a rate of 1.8cm/yr (over the period 1992-2003) and the West Antarctic Ice Sheet is thinning at a rate of 0.9 cm/yr. He writes: For the ROC, the 5:1 ratio in East versus West Antarctic area coverage causes slight thickening overall at a rate of 1.4 +/- 0.3 cm/yr."" Thus, it is a fair assessment to say that overall, Davis found that the portion of Antarctica in his ROC has been gaining ice. Indeed, the title of Davis's article states that, ""Snowfall-Driven Growth in East Antarctic Ice Sheet Mitigates Recent Sea-Level Rise."" We think this is good news, but the general public seldom (or never) hears it.""",SUBJ,1_1
State's efforts in renewable power. The idea that windmills will rescue,OBJ,0_0
"The administration has defended its efforts, asserting that there has never been any evidence that political influence factored into decisions about which companies would receive Energy Department loans. Republicans cited political connections between the loan recipients and the Obama administration as the fuel for their suspicions. For instance, a top Obama fundraiser was also a chief private backer of Solyndra, the solar panel company. Similarly, a major investor in Fisker is a venture capital firm that lists former Vice President Al Gore as a partner.",OBJ,0_0
"Researchers at the University of Alabama-Huntsville have published evidence supporting Richard Lindzen's iris theory, which says that when the Earth's surface warms, cirrus clouds open up to let the heat out. They have analysed data on rainfall and cloud cover and the heat escaping to space. They find a strong negative feedbank , confirming Lindzen's theory and directly contradicting the alarmist case.",OBJ,3_1
"This year is likely to be the ninth warmest on record, with global temperatures in 2012 cooler than the average for the past decade",OBJ,1_4
"The results of the analysis, summarized in Table VII-37, demonstrate that relative to the reference case, by 2100 global mean temperature is estimated to be reduced by 0.0026 to 0.0065 C, and sea-level rise is projected to be reduced by approximately 0.023 to 0.057 cm.",OBJ,0_0
"Chapter 4 of my book was devoted to the importance of proper discounting. Nigel Lawson did something very similar in his Chapter 7 with the title ?Discounting the Future: Ethics, Risk and Uncertainty.? For him, ?the choice of discount rate is critical in assessing which policies might make sense, and which clearly do not.? I agree with him that ?with a higher discount rate, the argument for radical action over global warming now collapses completely? (p. 83).",SUBJ,0_0
"Daschle thwarts ANWR vote, unveils own proposal",OBJ,0_0
"Basically, Dolinar et al. acknowledge that a large source of the uncertainties in outgoing longwave and shortwave radiation in GCMs is clouds.",OBJ,0_0
Back to the title question: Are anthropogenic greenhouse gases important in the warming of the global oceans?,OBJ,0_0
"But we needn't look only at the coal numbers. Last year, according to the BP report, global oil use grew by about 900,000 barrels per day and natural-gas use by about 700,000 barrels of oil equivalent per day. Thus, in one year, global hydrocarbon consumption increased by about 3.6 million barrels of oil equivalent per day. Let's compare that to the contribution of all global wind energy, which provided roughly 2.9 million barrels of oil equivalent per day in 2013, and all global solar, which contributed about 600,000 barrels of oil equivalent per day.",SUBJ,0_0
"The deep-ocean theory is one of a half-dozen explanations that have been proffered for the warming plateau. Perhaps the answer will turn out to be some mix of all of them. And in any event, computer forecasts of climate change suggest that pauses in warming lasting a couple of decades should not surprise us.",SUBJ,1_4
"The U.S. Postal Service announced Friday that it lost $8.5 billion dollars this fiscal year and blamed its financial problems on a significant decline in mail volume. The USPS operates off the revenue it generates from stamps and shipping costs, though it also has a $15 billion line of credit with the U.S. Treasury.",OBJ,0_0
Reported estimates from Teslas certified shops include:,OBJ,0_0
"on Friday, June 10th, 2011 at 5:06 pm and is filed under Uncategorized.",OBJ,0_0
"By August 23rd, 2006, we have seen 4 storms: Alberto, Beryl, Chris, Debby. Neither of them has been a hurricane - not even a small hurricane. Debby is the first one that at least has a chance to become a minimal hurricane on Sunday or so - but be sure that it won't become one. 2006 is not only milder than 2005 but also than 2004, 2003, and most other years. Right now, in the middle of the season, 2006 is below the average. December 2006 update : Indeed, it seems that the number of tropical storms (9) as well as hurricanes (5) as well as (minimal) major hurricanes (2) will stay below the average of 1950-2000. The season officially ended at the end of November. The absence of any tropical storms from the early October can be partially explained by a new El Nino.",SUBJ,1_7
"Outside of Europe, North America, Australia, and New Zealand also performed well. Had they ranked higher in the area of health, countries in these regions would have finished even higher. The United States comes in at ninth place and is the top ranked country of over 50 million people. Japan (sixteenth) and Hong Kong (eighteenth) make up the rest of the top twenty.",OBJ,0_0
"It should all be straight forward, but its not. In part because itreally is important to those who believe in anthropogenic global warming that temperatures are rising and it really is important to many so-called sceptics that they are not.",SUBJ,0_0
"Really now, you've got to be kidding me. Your link doesn't even mention this article. You're going to have to show actual proof that it is peer-reviewed, and if it is my opinion of the peer-review process in climate science"" will sink to a new all-time low. I didn't even mention many other flaws in this article, including not defining the word ""significant"" in the polling question. For many other flaws read the 100+ comments over at WUWT.""",SUBJ,0_0
"A new poll among 3,146 earth scientists found that 90 percent believe global warming is real, while 82 percent agree that human activity been a significant factor in changing mean global temperatures.",SUBJ,0_0
"In a world where glaciers are believed to be shrinking almost everywhere, the authors note that at the west end of the Himalayan arc, where China, India and Pakistan meet, an anomalous gain of mass has been suggested for the Karakoram glaciers,"" citing the findings of Hewitt (2005) - who first wrote about the ""Karakoram anomaly"" - as well as the subsequent studies of Zemp et al . (2009), Cogley (2011) and Scherler et al . (2011).""",SUBJ,0_0
"Today, EPA Administrator Stephen Johnson announced that EPA would respond to the Supreme Court global warming case, Massachusetts v. EPA, by issuing an Advance Notice of Proposed Rulemaking (ANPR) to solicit public comment on a range of complex issues.",OBJ,0_0
"Yet to date no empirical, theoretical or numerical method, complex or simple, has yet successfully specified mechanistically either how the heat generated by anthropogenic greenhouse-gas enrichment of the atmosphere has reached the deep ocean without much altering the heat content of the intervening near-surface strata or how the heat from the bottom of the ocean may eventually re-emerge to perturb the near-surface climate conditions that are relevant to land-based life on Earth.",OBJ,5_1
"Cootamundra News, sport and weather | Cootamundra Herald",OBJ,0_0
Kilimanjaro's link retreat and global warming,OBJ,0_0
"You would think that someone who is so sensitive about people criticizing or defaming himself, that he would be very careful about defaming and insulting others. Sometimes it seems like Mann spends half his day suing people for defaming him, and then the other half of his day defaming others on Twitter.",SUBJ,0_0
"At a minimum, the order sends a clear message to Colorado's largest investor owned utility, Xcel Energy, that the state's executive urges its compliance with the EPA's climate regulations and strongly encourages the governor-appointed Public Utilities Commission to approve Xcel's plans. At worst, it's a power grab.",OBJ,0_0
"The conclusion is stark the contribution of power from solar panels during winter months is effectively worthless, regardless of how many solar farms are built.",OBJ,4_4
Even China cant jump-start the electric car,OBJ,0_0
"It came as no surprise, then, that Senate Majority Leader Harry Reid, D-Nev., told reporters this week, One reason why we have the fires in California is global warming.""",SUBJ,0_0
ChiliPoker Set to Show US Online Gambling Laws Are a Joke:,OBJ,0_0
"The net effect of the joint cooling and warming adjustments appears to be two-fold in support of the UN/IPCC political science political science"" agenda.""",OBJ,5_2
"Week after week Boston was hit by blizzards, with literally no rain or warm temps to help melt the snow away. As the plows moved the snow to these farms, they piled up, became compacted, and turned what was once a light fluffy snow into a glacial mess of grand proportions.",OBJ,0_0
"Last night climatologist Gareth Jones tweeted that there had been two dozen papers on the pause this year. In response, I wondered how many would have been published if David Whitehouse hadn't have written his groundbreaking report on the subject. This prompted Doug McNeall to comment About two dozen"", a sentiment that was endorsed by Gavin Schmidt.""",SUBJ,1_4
Local newspaper boasts ultimate passive-aggressive paywall policy:,OBJ,0_0
"In the abstract the IPCC deserves it due. There has never been a large public policy issue as dependent on thorough science as climate change. The effort to get to the bottom of climate change is perhaps the largest scientific inquiry in human history. It requires the coordination of thousands of specialists, the development of whole new scientific techniques, and the refinement of elaborate computer models that need weeks to run on the most powerful supercomputers. Even discounting for the inherent weaknesses of computer models for any subject, this kind of sustained effort is likely to generate valuable and practical knowledge in the fullness of time. Producing coherent reports at regular intervals that combine all this work is an extraordinary feat.",OBJ,0_0
"Last year, destruction of CFCs accounted for more than half the CDM credits issued, in a market that will eventually, it is estimated, be worth $17 billion. Of the 1,390 CDM projects so far approved, less than 1 per cent accounts for 36 per cent of the total value.",OBJ,0_0
"Kevin D. Dayaratna, PhD, is Senior Statistician and Research Programmer in the Center for Data Analysis, of the Institute for Economic Freedom and Opportunity, at The Heritage Foundation. David W. Kreutzer, PhD, is Senior Research Fellow for Energy Economics and Climate Change in the Center for Data Analysis. Nicolas D. Loris is Herbert and Joyce Morgan Fellow in Energy and Environmental Policy in the Thomas A. Roe Institute for Economic Policy Studies, of the Institute for Economic Freedom and Opportunity.",OBJ,0_0
"Given the extremely long and complex planning processes, large subsidies required, political controversy and long construction times (Hinkley Points will be about 10 years), it is not unrealistic to assume that just two more reactors are built with similar capacity to Hinkley Point by 2030.",OBJ,0_0
"We have kept the Transport for London road network open throughout all this. We have about 90,000 tons of grit in stock, and the gritters were out all night to deal with this morning's rush. And yet we have to face the reality of the position across the country.",SUBJ,0_0
"But it seems that we don?t live in normal times. Because Polly Higgins, an environmentalist barrister and the initiator of the Planetary Rights campaign, was not only included in The Ecologist?s 2009 list of Top 10 Visionaries, but in 2008 she was even invited to address the United Nations. When Higgins launched a campaign last Friday to have ?ecocide?, the destruction of the natural world, recognised as an international crime, some commentators argued that this confirmed her brilliance and heroism.",SUBJ,0_0
"var pageTracker = gat. getTracker(UA-56526-1"");""",OBJ,0_0
"Obtaining the lithium for these batteries involves mining and scarring the earth as much as mining coal, which for the foreseeable future will generate much of our electricity. And we likely will be as dependent on foreign, and sometimes unfriendly, sources of lithium as we are for oil.",SUBJ,4_4
"8:30 International tide gauges also show: No acceleration in sea level rise. In fact tide gauges show a deceleration. Puls asked the Potsdam Institute for Climate Impact Research for an answer,but they have yet to reply.",OBJ,1_6
"These represent jobs and orders for equipment that are not occurring in the United States, along with the failure to utilize nuclear energy to provide the growing need for electricity here. The same environmental organizations opposing construction here are the same ones supporting the Environmental Protection Agency's attack on coal-fired electrical plants. The irony is, of course, that nuclear plants do not produce carbon dioxide emissions that the Greens blame for the non-existent global warming"", not called ""climate change.""",OBJ,0_0
"In the past, America becoming more like California might have been a good thing. If the President still believes that, he hasn't been paying attention.",SUBJ,0_0
"For this particular plant, as well as many other species that have been similarly tested (see Growth Response to Very High CO 2 Concentrations in our Subject Index), several-fold increases in the air's CO 2 concentration pose no problem at all to their growth and development. In fact, the more CO 2 there is in the air, the more biomass the tested plants have typically produced. Reviewed 28 June 2006",SUBJ,3_3
"29 Aug 2012 The arctic is melting, the 3rd runway remains on the agenda and the .... In the meantime, Australia will probably globally offset those German ...",OBJ,0_0
"Clearly, sea levels have actually been falling in the last decade, after very little change in the 1990s.",OBJ,1_6
"Dow and anti-LNG export Congressmen are dressing their opposition in populist garb. Both say it will raise prices, hurting consumers and industry alike. Last year, both Wyden and Markey told Energy Secretary Steven Chu that increasing exports would amount to a transfer of wealth from consumers to oil and gas companies.""",OBJ,0_0
"They also share many important beliefs and political attributes. They strongly believe that Americans can still advance through hard work, and they are the groups likeliest to believe that Wall Street helps America more than it hurts. While Libertarians are a bit more socially conservative than Post-Moderns, probably because they are older, Post-Moderns fit the libertarian-Republican pattern: Over three-quarters favor gay marriage, and similar numbers support legal abortion and believe illegal immigrants should have a path to citizenship. Both groups also perceive themselves as politically independent: Over 60 percent of each group describe themselves that way.",SUBJ,0_0
"Mawson Found Similar Ice Conditions, But Did Not Get Stuck",OBJ,0_0
"The Independent Institute held a briefing at the National Press Club on July 28 to launch a new report (available at http://www.independent.org ) on recent developments in climate science. As well as examining the recent debates over changes in climate over the past millennium and what the satellite records are telling us that have been extensively covered in this newsletter, the report also looked at two other areas: what research is telling us about urban mortality at higher temperatures and the institutional culture of the EPA and other public bodies.",OBJ,0_0
"( see footnote 1 SPM, page 3).",OBJ,0_0
"In the context of what appears to have been a one-degree Fahrenheit rise in mean global temperature since 1900, the observed relationship between temperature and precipitation in North America does not favor the hypothesis.",OBJ,0_0
"Temperatures have been directly measured for a little over a century. The number of locations at which temperature is taken has gradually increased, reaching something like full coverage only in the last thirty to forty years. It is certain that at many individual stations mankind has caused changes in measured temperature. Mankind caused both warming, due to the urban heat island effects, and cooling, such as by land use changes.",OBJ,5_1
"Global Warming Survey Draws Skepticism, Ho-Hum Response",OBJ,0_0
"Climate change: A new religion complete with evangelists, tithes, indulgences and superstitions",OBJ,5_2
"The British Met Office owns Britains most powerful super computer. It can make 1,000 billion calculations every second while consuming more electricity than a small town. The Met claimed that it will enable the Met Office to deliver more accurate forecasts, from hours to a century ahead. Some 400 climate high priests attend this electronic monster. But it has totally failed to forecast several frigid European winters because the model makers believe their own story and have programmed the models with a global warming bias. They assume without proof or evidence that carbon dioxide controls global temperature.",SUBJ,5_1
"So, if it is indeed sulfates cooling the warming, given that there is no net change in global temperature, then the northern hemisphere should be cooling since 1998 (the first year in Kaufmanns paper) while the southern warms. Here are the sad facts:",SUBJ,1_4
"Eighty percent of world trade travels by sea, and 60 percent of the world's oil is shipped by about 4,000 tankers: Were terrorist pirates to hijack a large bulk carrier or oil tanker, sail it into one of the chokepoints, and scuttle it to block the sea-lane, the consequences for the world economy would be severe: a spike in oil prices, an increase in the cost of shipping due to the need to use alternate routes, congestion in sea-lanes and ports, more expensive maritime insurance, and probable environmental disaster. Worse yet would be several such attacks happening simultaneously in multiple locations worldwide.""30""",SUBJ,0_0
"In fact, even those brave dissidents who have not yet had their meetings broken up by groups of savage goons are more and more openly saying that the nastiness that was National Socialism/Fascism/Communism now stalks the world again, in a new and more terrible form. This time, it is global. This time, leaders of once-democratic nations subscribe to its half-baked, unscientific notions and are themselves increasingly intolerant of anyone who dares to dissent.",SUBJ,0_0
"Modelling the vertical structure of water vapour is subject to greater uncertainty since the humidity profile is governed by a variety of processes. The CMIP3 models exhibited a significant dry bias of up to 25% in the boundary layer and a significant moist bias in the free troposphere of up to 100% (John and Soden, 2007). Upper tropospheric water vapour varied by a factor of three across the multi-model ensemble (Su et al., 2006). Many models have large biases in lower stratospheric water vapour (Gettelman et al., 2010), which could have implications for surface temperature change (Solomon et al., 2010).",SUBJ,5_1
H/T: Based upon the comment by Steve Case in this article :,OBJ,0_0
"Everybodypoor and minorities hardest hit. And our government does not have a vaccine against this disease, because there is no such diseasea typical uncaring Bush Administration response.",SUBJ,0_0
Environmentalism is a proselytizing religion. Skeptics are not merely people unconvinced by the evidence: They are treated as evil sinners. I probably would not write this article if I did not have tenure.,SUBJ,0_0
"Patsy Montana swears she Didn't Know the Gun Was Loaded . She's very, very sorry, and she'll never, never do it again. The comments are open, as always, for your Reader Tips.",SUBJ,0_0
"This finding, quoted verbatim, was one of the most critical findings of the Wells Report.",OBJ,0_0
"However, the American public is not clamoring for the closure of cost-effective coal-fueled power plants. What they want is cheap energy, but Obama is, as the Washington Post states: a President bizarrely antagonistic toward domestic energy production and low energy prices.""",OBJ,4_1
"Floods, hurricanes, droughts and famine are all blamed on man-made climate change and more is to come if we dont clean up our act we are told. One would have thought, listening to the doom mongers, that such disasters had never happened in the history of mankind until some Pandora-like figure had the idea of burning the energy out of coal and oil.",SUBJ,0_0
