0,subjectivity,1
"Then yesterday, up early, off to Heathrow, the joys of security, the long, long ten and a half hour non-stop flight back to San Francisco, the two-hour bus ride, then forty-five minutes by car to our house at the end of a dead-end road in the redwoods. This morning I woke up at 4 AM, which is noon GMT, and couldnt sleep now that the suns up, heres what the view from my place looks like ... warm, lovely, and very peaceful.",SUBJ,0_0
"Moderate progressives view the rejections of the Democrats from 1968 to 1984 as a sober lesson delivered by a sober populace. They view Americans today as wanting the same things economically that their parents and grandparents wanted from the New Deal: an active safety net that helps them move up in American life. In this view, Americans support Democrats when they use government to support and enhance middle-class values and aspirations. Moderate progressives believe Democrats got away from that heritage when they started to be perceived as worrying more about people who did not work than about those who did, as worrying more about criminals than the victims of crime, as worrying more about American aggression than about the freedom of the West.",SUBJ,0_0
"e) Finally, it is clear not so much fossil material on Earth that you can not even get a doubling of carbon dioxide in the atmosphere (this output has been about 600 ppm) a hjningsniv, somav many hvdas correspond to a temperaturhjning p about 1 degree, apart from the effect avallt soot that would come out from the mngdmssigt dominant deposits of coal.",OBJ,0_0
Plant Growth Database (6 April 2015),OBJ,0_0
"Putin disagrees, but hopes Obama goes on thinking as he does.",SUBJ,0_0
"???We found that previous estimates of historical temperatures during the Roman era and the Middle Ages were too low,?? says Esper. ???Such findings are also significant with regard to climate policy, as they will influence the way today??s climate changes are seen in context of historical warm periods.??",OBJ,2_1
"Electric power is the quickest, surest, cheapest way to lift people out of poverty, disease, subsistence agriculture and childhood death ? thereby stabilizing India?s population, which may soon overtake China?s.",OBJ,0_0
"Getting the message out to the wider world is what we do here at WUWT, happy to help.",SUBJ,0_0
Eco-warriors are losing the public relations battle on global warming -- and it's driving them batty.,OBJ,0_0
"Walkies in the Spring Snow, 6th April 2008:",OBJ,0_0
"Allow all energy projects to form master limited partnerships. Master limited partnerships (MLPs) are taxed as limited partnerships, but are publicly traded on the stock market. In the energy sector, the ability to form MLPs is available for mineral extraction, natural gas, oil, pipelines, geothermal, and the transportation and storage of ethanol, biodiesel, and other alternative fuels. Other renewable energy generation and commercial nuclear activities do not qualify. The next Administration should end the practice of using the tax code to pick winners and losers.",SUBJ,0_0
"6. Empirical evidence shows that Earth is currently greening"" significantly due to additional CO2 and a modest warming.""",OBJ,3_3
"Consider, as a sign of the party's decadence, how quickly Bob Corker, a card-carrying member of the Republican Party elite the center-right chair of the Senate Foreign Relations Committee caved in to this horribly miscast party standard-bearer. Trump's campaign has been filled with statements whose ignorance and bombast have appalled the establishment. Then a ballyhooed foreign policy speech in late April was widely panned by experts across the foreign policy spectrum. (A very odd mishmash""; ""strident rhetoric masked a lack of depth."") Corker's response? He praised ""the broadness, the vision"" of the speech.""",OBJ,0_0
"Judge Rules I Heart Boobies' Bracelets Are OK For Students to Wear:""",SUBJ,0_0
"There are evironmental commodities markets developing internationally in order to combat climate change, slow biodiviersity decline, carbon dioxide emissions, and other problems. Incentives are needed for producers and consumers so as to make better use of natural resources. This approach allows flexibility in the system and provides signals to producers and consumers alike. The problem is that tracking or monitoring these emerging markets is difficult. Thus, the author contends that, by handling vast amounts of in- formation efficiently, information systems permit accurate tracking of emissions and allowance accounting to ensure compliance. Furthermore, Internet access to regulatory in- formation increases the transparency and accountability of market-based environmental management.""",OBJ,0_0
Fox News reports on emails CEI found in their FOIA lawsuit against George Mason University professors that reveals their petition to the government to prosecute climate change skeptics.,SUBJ,0_0
"Local copepod diversity, especially in extra-tropical regions, is likely to increase with climate change as their large-scale distributions respond to climate warming.",OBJ,0_0
"Another fearmongering Stonyfield ad reads, Earth to mom! Yogurts made without the use of antibiotics, hormones and toxic pesticides.""",OBJ,0_0
"On the other hand, Italian researchers have just finished surveying bird species in a high Piedmont valley where the temperature since the early 1990s has increased about 1 degree C. How did the birds adapt? They did nothing. Sixty-eight bird species were detected in both the 1992-94 survey and the 2003-05 survey. The researchers report the number of species whose mean elevation increased (42) was higher than the number whose mean elevation decreased (19)."" But the birds move up an average of just 29 metersnot statistically different from zero.""",OBJ,3_2
"One of the most cited and used historical surface temperature databases is that of NASA/Goddard's GISS. This is not some weird skeptics site. It is considered one of the premier world temperature data bases, and it is maintained by anthropogenic global warming true believers. It has consistently shown more warming than any other data base, and is thus a favorite source for folks like Al Gore. These GISS readings in the US rely mainly on the US Historical Climate Network (USHCN) which is a network of about 1000 weather stations taking temperatures, a number of which have been in place for over 100 years.",SUBJ,5_1
"It looks to me like the error band on precipitation makes it completely impossible to know what CO2 might or might not be doing. It can only be an article of faith. Since we have no clue, really, how precipitation changes happen over the PDO / AMO cycles to 2% of variation, how can we say if any warming or cooling is CO2 induced or precipitation dependent?",SUBJ,5_1
"Tesla has now sold more than 85,000 cars in the U.S. With the introduction in late 2017 of the Model 3, which has a tentative base price of $35,000, Tesla will soon reach 200,000 vehicles sold, and the subsidy will then be phased out.",OBJ,0_0
"They note: As has been acknowledged by numerous scientists, the engine intake data are clearly contaminated by heat conduction from the structure, and as such, never intended for scientific use.""",OBJ,5_1
"Water vapor, thanks to the sheer quantity of it in the atmosphere, is the most important of the greenhouse gases, accounting for 65-85% of the natural greenhouse effect without which the Earth would be an ice planet. Since 71% of the Earth's surface is covered in water, evaporation, convection, advection, subsidence, and precipitation are occurring somewhere on Earth all the time. Precisely because the concentration of water vapor in the atmosphere the absolute humidity"" is so high, adding just a little more with cooling towers from power stations and other industrial sources has virtually no influence on the greenhouse effect.""",OBJ,0_0
"In dagslget is unclear what will be pieces of the text to be produced in Cancn, Mexico, in December and nobody knows what will happen with the current agreement, the Kyoto Protocol, that progressively in 2012",OBJ,0_0
Full text (note this is an unsigned draft) here and reprinted below the fold.,OBJ,0_0
"He also says that the correct explanation of some suicidal behavior of bees involves the genes' desire to spread themselves (even if the genes are located in the queen, a different individual from the kamikaze bee). Human altruism may be predominantly explained by the individual desires to spread their broader kin with similar genes (regardless of more noble explanations that are sometimes being offered); so whenever the individual humans aren't the right unit"" that enters natural selection, the more correct unit is actually a smaller one (gene) and not a larger one (society).""",OBJ,0_0
The nation seems to be passing through a period in which too many U.S. Senators have been elected without so much as a high school level understanding of what drives the Earths climate and it isnt the 0.038% of carbon dioxide (CO2) in the atmosphere.,SUBJ,2_3
"Their own graph shows that Arctic sea ice extent is just below normal, and melting unusually slowly.",OBJ,1_1
"Note that with considerable smoothing of the data, we see a peak imbalance around 0.6 W m-2 during the maximum warming rate around the year 2000.",SUBJ,0_0
"The U.S. Energy Information Administration (EIA) has estimated the potential savings from a nationwide 25% renewable electricity standard, a goal included in the Waxman-Markey energy bill that narrowly passed the House last year. Best-case scenario: about 306 million tons less CO2 by 2030. Given that the agency expects annual U.S. carbon emissions to be about 6.2 billion tons in 2030, that expected reduction will only equal about 4.9% of emissions nationwide. That??s not much when you consider that the Obama administration wants to cut CO2 emissions 80% by 2050.",OBJ,4_2
The Nevada program is a huge breakthrough for the school choice movement and was a long time coming. The Heartland Institute has been advocating education savings accounts since 1992 and I am proud to say has done more to promote the idea to state legislators than any other think tank or advocacy organization in the country.,SUBJ,0_0
"Wunsch wrote that, The Gulf Stream's existence is a consequence of the large-scale wind system over the North Atlantic Ocean, and of the nature of fluid motion on a rotating planet. The only way to produce an ocean circulation without a Gulf Stream is either to turn off the wind system, or to stop the Earth's rotation, or both."" He added, ""The occurrence of a climate state without the Gulf Stream any time soonwithin tens of millions of yearshas a probability of little more than zero.""",OBJ,0_0
"The results of the authors' analysis support a link between long-term variations in cyclonic activity and trends in solar activity/GCR flux in the extratropical latitudes of the North Atlantic.?? Concerning how this relationship works, the authors hypothesize that GCR-induced changes in cloudiness alter long-term variations in solar and terrestrial radiation receipt in this region, which in turn alters tropospheric temperature gradients and produces conditions more favorable for cyclone formation and development. Although we are still far from a complete understanding of many solar/GCR-induced climatic influences, this study highlights the ever-growing need for such relationships to continue to be explored.?? As this study and others have shown, small changes in solar output can indeed induce significant changes in earth's climate.?? The empirical evidence for such phenomena continues to mount (see Solar Effects and",SUBJ,2_1
"Parameters NST=330, Nph=362, Dmin=409.7 km, Rmss=1.26 sec, Gp= 14,",OBJ,0_0
7 Apr 2015 Thick drifts of snow in Korca.,OBJ,0_0
"The debate over Common Core has had the opposite effect Obama hoped for. The public learned the national government doesn't belong in the school curriculum business, and that activist groups on the left use schools to indoctrinate rather than educate their children. Parents are fleeing public schools for private schools or are homeschooling their children rather than risk exposing them to Common Core.",OBJ,0_0
"how to restore climate change"" as a top global priority after the fiasco of last year's Copenhagen summit;""",OBJ,0_0
"You can read the whole paper Carbon cycle modelling and the residence time of natural and anthropogenic atmospheric CO2: on the construction of the ""Greenhouse Effect Global Warming' dogma"" by Tom V. Segalstad, one of the chapters in the book Bate, R. (Ed.): ""Global Warming: The Continuing Debate"", European Science and Environment Forum (ESEF), Cambridge, England (ISBN 0-9527734-2-2), pages 184-219, 1998.""",OBJ,0_0
Australias antarctic runway melting | Southern Cross,OBJ,0_0
"Phil, thanks for your thoughts ? guarantee there will be no dirty laundry in",SUBJ,0_0
"The farmers group will hold a protest outside state parliament in Sydney on Tuesday, which it says will attract thousands of people angry about the governments approach to controversial coal seam gas exploration.",OBJ,0_0
"While that descent has been underway for a long time, it has accelerated its pace in recent years. We noted four years ago the dysfunction of the Republican Party, arguing that its obstructionism, anti-intellectualism, and attacks on American institutions were making responsible governance impossible. The rise of Trump completes the script, confirming our thesis in explicit fashion.",SUBJ,0_0
"Will reduced solar activity counteract global warming in the coming decades? That is what outgoing Germanelectric utility executive Fritz Vahrenholt claims in a new book.In an interview with SPIEGEL, hearguesthat the official United Nations forecasts on the severity of climate change are overstated and supported by weak science.",SUBJ,0_0
"Unfortunately, what will likely emerge a few months into the Clinton presidency is a deep desire by Republicans to recapture the party mojo by once again prevailing in the forthcoming 2018 midterm elections by using the old scorched-earth strategies. Following the road maps of 2010 and 2014, party leaders will want to demonize the president, delegitimize Washington and the policy process, and block any meaningful policy action that could lead to a Clinton signing ceremony, feed on the anger at the grassroots.",OBJ,0_0
"There is no such thing as environmental justice."" It is an invention of environmental groups that are intent on convincing people that whatever they do or fail to do somehow has an impact on the weather.""",OBJ,0_0
"A chain, we all know, is only as strong as its weakest link. We must have extraordinary confidence in the integrity of every link before we trust it. Has the process been sound? Has the globe warmed? Are we humans to blame? Will any warming continue? Would the impacts be terrible? Would the proposed solutions do any meaningful good? Will the benefits exceed the costs? Let any link in this chain of questions fail, and the treaty cannot be justified. It would be all pain, no gain and should be scrapped.",SUBJ,0_0
"Note: Writing in Nature Senevirnate (2012) argues with respect to global trends that, there is no necessary correlation between temperature changes and long-term drought variations, which should warn us against using any simplifications regarding their relationship.23",SUBJ,1_7
the level of uncertainty in the ocean data has not been emphasized. This post is to highlight this issue with respect to modeled uncertainty ofocean heat content changes.,OBJ,0_0
"The Israelis and the majority Fatah wing of the PLO now share a vital interest in the containment of Hamasthe Iran-backed radical Sunni groupwhich, during the summer of 2007, violently seized control of the Gaza Strip.",SUBJ,0_0
"There is no greenhouse effect. Like two years ago, you again offer the fact down-welling IR measured by pyrometer (IR thermometer) from cold CO2 in sky at 300 w/m 2 as proof heat transfers at that rate from cold CO2 to warmer surface, is absorbed by surface, heating it and causing it to radiate more intensely. It proves no such thing. I explained you are confusing S-B irradiance or intensity of radiating matter with radiating heat transfer between two radiating matter bodies, driven by an intensity difference. Just because they share the same units, w/m 2 , does not mean they are the same phenomena. So your argument doesnt hold water, or GHGT. Since there is no greenhouse in the sky, how can there be a greenhouse effect?",SUBJ,2_3
T(k) = F(k)(1 exp(-1/ ) + T(k-1) * exp(-1 / ),OBJ,0_0
"The problem with these sorts of studies is that no class of proxy (tree ring, ice core isotopes) is unambiguously correlated to temperature and, over and over again, authors pick proxies that confirm their bias and discard proxies that do not. This problem is exacerbated by author pre-knowledge of what individual proxies look like, leading to biased selection of certain proxies over and over again into these sorts of studies.",OBJ,5_1
"Even though the state gave snow-buried cities and towns in Massachusetts permission to dump snow into the ocean, due to emergency situations,"" Boston decided it had better not. Also in the man-made glacier were piles of uncollected garbage, trashcans, even fire hydrants. Experts think the snow pile will still be around, at least until August.""",SUBJ,0_0
"When I talk to people about the insidious reach of big government one example Ive been using lately is that of The Netherlands. In the name of carbon-pollution the government of the Netherlands wants to have a GPS in every car in order to charge people for their CO2 emissions. Each GPS will track where and when every car moves, radio the data in and an audit office will calculate CO2 emissions based on kilometers driven and the car model. They will also know exactly where people go and how long they stay there for, 24 hours a day.",SUBJ,0_0
"Led by Earthjustice, the Conservation Law Center, Natural Resources Defense Council, National Geographic Society, and the Pew Charitable Trust, environmentalists are urging the White House to use the 1906 Antiquities Act to designate a 6,000-square-mile area in the Gulf of Maine and off the coast of Massachusetts as a National Monument. The area is home to spectacular geological formations, including Cashes Ledge, an underwater mountain system, and the New England Coral Canyons and Seamounts, an undersea chain of formations about 150 miles off the Massachusetts coast.",OBJ,0_0
"It's SUPPOSED to be a commentary on people who don't believe in AGW killing themselves because the planet is supposedly doomed if we have lightbulbs that work and enjoy life and all its wonders to the fullest, instead of taking civilization back hundreds of years for no reason.",SUBJ,0_0
"An email sent to environmentalists Sunday evening, obtained by The Hill, tallies numerous instances of Obama talking about climate change on the stump.",OBJ,0_0
"According to Delingpole, the Climategate story fell into his lap and changed his life. His pitch to the conference attendees was how we represent the happy people who want a good life. Also, that we have a place in this war. The war we are fighting is for our liberty. It is between two opposing views of the world. It's also a propaganda war. James Delingpole is the author of Obamaland: I've Seen Your Future And It Doesn't Work.",SUBJ,0_0
"The effects of snow-free winter in Britain are already becoming apparent. This year, for the first time ever, Hamleys, Britain's biggest toyshop, had no sledges on display in its Regent Street store. It was a bit of a first,"" a spokesperson said.""",OBJ,0_0
"PG&E;, Exelon, Duke -- progressive companies or energy-rationing profiteers?",OBJ,0_0
"If Americans these days tend to have forgotten something as basic as the security dilemma, Europeans for their part have serious difficulties remembering something equally basic that they used to perform with undeniable virtuosity: coercive diplomacy. Be it with Iraq yesterday or Iran today, an astounding percentage of the allegedly sophisticated EU elites have the hardest time grasping what any American redneck knows intuitively: namely, that the collective threat to use force is still the best way to avoid having recourse to actual force. Fifty years of increasing focus on intra-EU politics has led EU elites to mistake multi-level governance"" (read: horse-trading by capitals in Brussels) for the whole of statecraft. But genuine diplomacy always rests on the implicit threat to use force, and the EU mantra about force as last resort should logically lead Europeans to view coercive diplomacy as their preferred weapon.6""",SUBJ,0_0
"The Kyoto Protocol calls for U.S. taxpayers to make similar contributions -to Third World nations. Funds distributed by the GEF have already been used to curtail. energy use in India, for example. If Congress continues to fund the GEF, the Clinton administration will claim that enough developing countries are participating in the Kyoto treaty to warrant Senate ratification.",OBJ,0_0
"The Board voted 6-2 in favor of amending the standards to, as the Charleston Daily Mail reports, allow students to use scientific models to form their own conclusions on the debated topic.""",OBJ,0_0
"The danger in EPAs authority to regulate GHGs is amplified by the fact that EPAs source of regulatory authority is the CAA. To trigger regulation under the CAA, EPA must make a finding that GHGs may reasonably be anticipated to cause or contribute to the endangerment of public health or welfare. We learned again from yesterdays decision what a permissive standard this is. At oral argument, one of Judge Sentelles first statements to petitioners counsel was something to the effect of I hope youre not going to ask us to make a judgment on the science. Personally, I am a climate skeptic I have read through the climategate emails and have been appalled. But the courts continue to show reluctance to truly engage EPAs science findings (or even to allocate sufficient words to adequately brief these highly technical issues).",SUBJ,0_0
Met Office 2010 Forecast: Winter To Be Mild Predicts Met Office,OBJ,0_0
"bogging down, nato would hand off responsibility for the areas they had taken to Afghan forces.",OBJ,0_0
"Thus, the drop in annual GDP growth that was so insignificant in Krugman??s mind, when it came to measuring the economic costs of aggressive carbon legislation, is just shy of the drop in annualized GDP growth matching up with the environmental benefits of such legislation, in the worst case scenario. But when we realize that Krugman??s estimate of 2% GDP loss by 2050 is much lower than what the IPCC itself says (as I document in the earlier posts linked above), the answer is a no brainer: The benefits of fighting climate change do not exceed the costs, even using the IPCC??s own models.",SUBJ,4_1
"Scatterplot graph of U.S. Palmer Drought Severity Index (PDSI) -vs- NASA GISS temperature data. If there was a correlation between temperature and droughts in the USA, the dots would align along a line from upper left to lower right (or mirrored LL to UR, depending on the correlation). But, as the plot shows, there is no correlation between drought & temperature of any kind.",OBJ,1_7
To reach the multimeter levels projected for 2100 by RV requires large positive accelerations that are one to two orders of magnitude greater than those yet observed in sea-level data.,OBJ,1_6
"The Treasury will issue net medium- and long-term debt of 47.2 billion euros ($62.04 billion) in 2011, down from 62.1 billion in 2010, the Economy Ministry said on Wednesday.",SUBJ,0_0
"States in decades past. In the same vein, the limits Obama put on the American",OBJ,0_0
"Professor Stephan Lewandowsky may not understand much about the climate, but he is a professor of psychology so satire, humor, and hoaxes ought to be right up his alley, right? Hes realized he fell for the brilliant Alene Composta (a master satirist) replying to her and even sending her fake request for advice to fellow blogger John Cook ( who fell for it too ).",OBJ,0_0
"Comment: This response does not address the criticism that even if one sentence of the guidance documentanticipates that permitting agencies may ultimately exercise the discretion to require fuel switching in individual cases, the EPA gave no hint that next year it wouldrequire all new fossil fuel power plants to be either NGCC or non-economical coal with CCS. Note, too, that implemented at commercial scale is not the same as commerciallyviable , i.e., sustainable without taxpayer subsidies.",SUBJ,0_0
"While some governments regard GHG control as high priority, others have concluded that paying to curb domestic GHG discharges is not, at least for now, in their interest. For many poorer nations, economic development offers better protection from harmful climate change than do GHG limits. This choice makes sense. Industrialization can boost the ability to adapt to climate change. Of course, it can also relieve many other more acute problems. For these countries, slowing growth in the name of GHG control may simply be a bad investment.",OBJ,0_0
