0,subjectivity,1
"An interesting feature of the models is that almost all show greater year-to-year variability than observations (Fig. 1.) The average model annual variance (detrended) of anomalies is 60 percent greater than that of the observational datasets. This is a clue that suggests the models atmospheres are more sensitive to forcing than is the real climate system, so that an increase in greenhouse forcing in models will lead to a greater temperature response than experienced by the actual climate system. But saying the climate models are too sensitive only identifies another symptom of the issue, not the cause.",OBJ,5_1
"IT MAY be time to stop describing south-eastern Australia as gripped by drought and instead accept the extreme dry as permanent Perhaps we should call it our new climate, said the Bureau of Meteorologys head of climate analysis, David Jones. January 4, 2008 The only uncertainty now was whether the changing pattern was 85 per cent, 95 per cent or 100 per cent the result of the enhanced greenhouse effect",SUBJ,0_0
Among the longest records of active hurricane zones is on the US east coast. NOAAs Hurricane Research Division has data back to 1851. No major hurricane (category 3 or more) has hit the continental US since Wilma in October 2005. That is the longest pause on record. NOAA says It is premature to conclude that human activities and particularly greenhouse gas emissions that cause global warming have already had a detectable impact on Atlantic hurricane activity.,OBJ,1_7
"The doomsday stories of the pikas impending extinction began with a few contentious papers by Dr. Erik Beever. He re-surveyed a small subset of Nevadas pika populations and reported 28% (7 of 25) of pika territories, which had been occupied at the beginning of the 20 th century, were now vacant. He suggested those 7 populations had gone extinct possibly due to climate change. That claim was then trumpeted by groups like the National Wildlife Federation with articles like No Room at the Top .",OBJ,0_0
2. One would expect greater agreement with recent data in more recent years. But since 1997 the difference in temperature anomalies has widened by nearly 0.3 celsius GISSTEMP showing rapid warming and HADCRUT showing none.,OBJ,5_1
It was warmer in the Middle ages* and medieval climate change in Greenland was much faster.,OBJ,2_1
24. With how much certainty can we attribute recent climate related disasters to climate change?,SUBJ,0_0
The rest of us may want to consider a few facts before we start to hyperventilate.,OBJ,0_0
"Attempts to resolve the arguments are plagued with problems, a lot of which are inherently insoluble. There are many aspects of the behaviour of the natural climate system and of human society that are unpredictable in principle, let alone in practice. But perhaps the biggest of the underlying problems, and it is common to both arguments since it inevitably exists when there is large unpredictability and uncertainty, is the presence of strong forces encouraging public overstatement and a belief in worst-case scenarios.",SUBJ,5_1
Can you explain to me how it will save one ton of carbon dioxide? Of course not! What you want is just a sham reduction of carbon dioxide.,SUBJ,0_0
"After learning that most of the delegates had indeed arrived by plane, Gaia asked, Have you been washing your clothes in a machine, or do you take them down to the river to wash by hand? Do you watch television? Use a computer? You don't refrigerate your food do you? Did you bring the food home in a car? All carbon sins! You're lucky I'm selling carbon indulgences today and I've brought free samples for all delegates.""",SUBJ,0_0
"Minnesota opens the door to new nukes , just a crack.",OBJ,0_0
"They just carry on as usual, ignoring any challenges along the way. They have to go for it in a different way, with the likely non-renewal of Kyoto. Global Governance here we come.",OBJ,0_0
We have found no indication that sea level has accelerated over the last 30 years. It doesnt look good for the fans of acceleration.,OBJ,1_6
An Agenda for the Monday a.m. Obama and Bush Meeting,OBJ,0_0
"The Minister might have got away with saying that of the last 150 years, the last 13 have been relatively warm. But to suggest that 12 of the last 13 are the hottest ever is just plain wrong. Whatever happened to the medieval warm period, not to mention that planet earth is very old in fact about 4,550 million years old.",OBJ,2_1
political to the extent that the issues are controversial either in domestic,OBJ,0_0
"Still, there appears to be no groundswell of Israeli public opinion against the two-state solution. The implications of an Israeli state seeking to control an Arab population several times its size is not lost on Palestinian observers. For example, Jarbawi, the minister of planning, asks, Do I have to advise the Israelis, ""Take the two-state solution, because in twenty years, you'll be a minority and have to oppress us like apartheid, and in one hundred years you won't exist'?"" Even some Israelisdiplomat Shimon Stein among themacknowledge that more could be done to move the process along: ""The demographic issue is like climate changeno one wants to pay today for what may or may not happen twenty years from now.""",SUBJ,0_0
"So, based on the most up to date numbers from the IPCC AR5 report itself and using the most robust methodology on the data with the best signal-to-noise ratio, one arrives at an observationally based best estimate for TCR of 1.30C, or 1.36C based on the unadjusted AR5 aerosol forcing estimate.",OBJ,0_0
Caption: This is Professor Chris Turney in the field in Svalbard. Credit: University of Exeter,OBJ,0_0
"The book that sprung forth from that conference, The Costs of Kyoto: Climate Change Policy and Its Implications, explored the economic and social costs of an international climate treaty, the scientific basis for a treaty, and the broader implications the global warming issue has for environmental policy in the United States and abroad. Taken as a whole, these essays demonstrate that the risks of global warming may be less than the risks imposed by global warming policy.",OBJ,0_0
So IPCC is not the only organization using WWF pamphlets as authority.,OBJ,0_0
"There is a discussion whether koda should be producing more upscale cars or sporty cars than so far. There may be different paths to success. koda's historical track record is undoubtedly more luxurious than Volkswagen's just recall what the word Volkswagen means but on the other hand, it's been successful thanks to the production of value cars with some cool simply clever"" details and it would be crazy to throw this recipe for success as long as it seems to work.""",SUBJ,0_0
"A new review paper from SPPI and CO2 Science concludes,  In summation, and in view of the numerous similar findings from across a wide and varying geographic area, it would appear that much of Canada has (1) experienced less-variable extreme moisture conditions, as both it and the rest of the world have emerged from the relative cold of the Little Ice Age and are now basking in the greater warmth of the Current Warm Period, and that (2) this finding appears to be independent of the atmosphere's CO2 concentration.""",OBJ,2_3
"This raises some interesting questions. Is there any difference between cap-and-trade and a carbon tax? Is cap-and-trade the only politically viable approach? And would either have a chance against The Status Quo, who is drawing new fans in the midst of the economic downturn?",SUBJ,0_0
"Whatever alternative technologies they support comply with their precautionary principle. Whatever they oppose violates it. They trumpet alleged risks of using frackingand hydrocarbon technologies, but ignore even the most obvious benefits of using them and most obvious risks of not using them.",OBJ,4_5
"The United States alone can do next to nothing about greenhouse gas emissions alone and we should not burden our economy to attempt to do so. China and India are growing so rapidly that their additional greenhouse gas emissions swamp any reductions possible in the U.S. today. For example, Chinese car ownership today on a per-capita basis is not even equal to U.S. car ownership in 1920.",SUBJ,4_2
"Because the two experiments yielded nearly identical results, we will focus our discussion on experiment two, since it was of greater duration.?? Elevated CO 2 apparently reduced rates of transpiration in all seedlings shortly after the start of the experiment.?? After 30 days of differential CO 2 exposure, seedlings growing at 700 ppm displayed shoot water potential values that were nearly 40% higher (less negative and thus less stressful) than those measured in seedlings growing at ambient CO 2 .?? At the end of the 82-day dry-down, elevated CO 2 had significantly increased seedling root and shoot biomass by 37 and 46%, respectively, regardless of the region from where the seeds they sprouted originated.?? Moreover, atmospheric CO 2 enrichment more than doubled seedling survivorship under drought conditions without significantly favoring one genotype over another. What it means",SUBJ,3_3
"I thought this post on clouds and climate modeling below from Steve McIntyre??s Climate Audi t was interesting, because it highlights the dreaded ???negative feedbacks?? that many climate modelers say don??t exist. Dr. Richard Lindzen highlighted the importance of negative feedback in a recent WUWT post .",SUBJ,3_1
"Heres a quandary for the global warming crusade. The scientists state that Despite significantly cooler than modern SSTs in the Atlantic during the latter half of the Little Ice Age, the frequency of intense hurricane landfalls increased during this time. Had these two found an increase in hurricane activity given warmer conditions, they would be paraded right down Broadway. But finding increased activity in colder periods means no parade, but a feature in World Climate Report.",OBJ,1_7
China slows its runaway high-speed rail expansion:,OBJ,0_0
"The process of a cosmic ray particle colliding with particles in our atmosphere and disintegrating into smaller pions, muons, and the like, is called a cosmic ray shower . These particles can be measured on the Earths surface by neutron monitors.",OBJ,0_0
"As illustrated and discussed in If the IPCC was Selling Manmade Global Warming as a Product, Would the FTC Stop their deceptive Ads? , the IPCCs climate models cannot simulate the rates at which surface temperatures warmed and cooled since 1901 on a global basis, so their failings illustrated in this postare not abnormal.",SUBJ,5_1
"Next week, the House of Representatives will vote on H.R. 2, a measure to repeal Obamacare in its entirety. The Congressional Budget Office (CBO) today released a report stating that repealing the health care law would increase the deficit by $145 billion between 2012 and 2019.",OBJ,0_0
rsringar from uniting in Tibet and pines in Jmtland shows that climate ndrades properly on pure 400 and 600. The average temperature can have svngt as much as television degrees p ten years.,OBJ,0_0
"Climategate 3.0: Mr. FOIA"" says lying elitists are destroying civilization""",OBJ,5_2
"By Robin KcKie, The Guardian, UK, Aug 9, 2015",OBJ,0_0
"And in a broader vindication of democracy and capitalism, it is interesting that chavista nations in Latin America do very poorly in the Prosperity Index; Venezuela (seventy-fourth), Ecuador (seventy-first), and Bolivia (seventy-third) are ranked far lower than the more open democracies of Chile (thirty-sixth), Argentina (thirty-eighth), and Brazil (forty-first).",OBJ,0_0
"It is hard to be too confident about the temperature record from 1850, to mention an example. I am not sure whether it's almost correct or almost completely wrong. But the agreement between the different datasets that treat the homogenization and other issues differently NASA's GISS, NOAA's NCDC, the Japanese global dataset, BEST, and Hadley Centre + Met Office's HadCRUT4 leads me to believe that all the methods that these surface weather station scientists apply to the raw data are basically right.",SUBJ,0_0
Who denies that CO2 lags temperature in the ice core data by as much as 800 years and hence isa product of climate change not a cause?,SUBJ,2_3
"In the face of another diplomatic disappointment in Cancuns climate change talks, we approach the end of the hottest year on record. While experts again try to ring alarm bells, our media still gives voice to the pseudo-intellectual pursuit of climate skepticism. Perhaps while Rome burned, some bravely questioned the finer qualities of fire. Perhaps on Easter Island, as the last trees fell, some elders courageously debated the necessity of wood.",SUBJ,0_0
"fuel needs. So its not making us energy independent at all, and its""",OBJ,0_0
"Rare indeed, though, is the lie which is both of the mammoth society-destroying type and which has reached the level of Received Wisdom throughout an entire elite leadership structure, and then which suddenly and very publicly is revealed to all as the fraud it is, before extremes of destruction are reached. In fact, on reflecting through history, I can't think of an example.",OBJ,0_0
"Vice President Al Gore has not yet presented the Senate with the global-warming treaty he negotiated last December in Kyoto, Japan, but it??s a ticking time bomb for farmers in the United States and the rest of the First World.",SUBJ,4_1
"Would federal investment in renewable energy technologies make Kyoto feasible and affordable? Not even remotely, says Mills. Just to meet 30% of the expected growth in U.S. electricity demand over the next 20 years, wind and solar power would have to expand output 37,000-fold! No combination of tax preferences, outright subsidies, or Apollo-style R&D; programs could accomplish such a miracle. Kyoto can't be done smart.""",SUBJ,0_0
"Vice President Wayne Crews talks about where the writers of the Pledge"" should go from here.""",SUBJ,0_0
"Robert Reinstein has had a series of careers spanning almost four decades of professional experience in science, economics, and diplomacy. Among other senior policy making positions, he was principal negotiator for the Bush Administration at the Rio Treaty and on the energy aspects of the both Uruguay Round of the General Agreement on Tariffs and Trade (GATT) and the U.S.-Canada Free Trade Agreement. Reinstein also chaired two working groups of the Intergovernmental Panel on Climate Change (IPCC).",OBJ,0_0
"Figure 21: Comparison of temperature with human emissions of carbon dioxide. Human emissions were negligible before 1850, so how could they have caused the global warming from 1700 to 1850? Source: Temperature as per Figure 17, emissions see text. ...",SUBJ,2_1
Some scientists have even argued that increased coal use in China has caused the planet to cool slightly. But there does not seem to be any solid agreement on what caused global surface temperatures to stop rising.,OBJ,0_0
Atmospheric radiosonde temperature trend (Angell) = 0.3 F/decade,OBJ,0_0
"The agency is still actively considering a wide range of comments on this issue, and any final decision will reflect careful consideration of the issue.",OBJ,0_0
"two of the doctrine's leading exponents, General David Petraeus and General Stanley McChrystal, were",OBJ,0_0
"Let us ed from a case where the atmosphere contains 1 unit concentration of carbon dioxide, which in str jmvikt with ythavet, and in turn, the deep sea, both of which contains 10 units. We assume also that ythavet and deep sea ri jmvikt.",OBJ,0_0
Such claims have become popular among academic sophisticates.,OBJ,0_0
"Johanna any, and I mean any, attempt to explain barbarous and murderous behaviour by others on Western democracies is just a variant of the middle-class guilt that alleges that we are destroying the planet by having healthy and wealthy lives",OBJ,0_0
"Because people knew that with Satans help one could cook the weather, the extreme weather and harsh conditions during that period contributed to mass executions and Witch Trials.",OBJ,0_0
"For the longest time, this industry's well-funded disinformation campaigns have duped reporters into practicing a profoundly distorted form of journalistic balance. In the early 1990's, the coal industry paid a tiny handful of dissenting scientists (with little or no standing in the mainstream scientific community) under the table to deny the reality of climate change.",OBJ,0_0
"EPA is also giving billions of taxpayer dollars to activist groups, to advance its agenda and dominate our media and hearings with false or misleading information about the costs and benefits of its programs.",OBJ,0_0
"The peace process falls under Abbas's jurisdiction, and there have been rumors of dissension, or at least coolness, between Abbas and Fayyad. Nor is Fayyad, a member of the Third Way"" splinter party, certain to win the support from Fatah that he will need to serve another term. What is important is that Abbas and Fayyad present Palestine as a viable state, able to navigate the rapids of independence and find a way to reunite Gaza with the West Bank.""",OBJ,0_0
"Putting the president's fortune in Congress's hands not only makes for poor politics, it runs counter to the Framers' plans for the office. They saw Congress, not the presidency, as the main threat to the people's liberties. In a democracy, James Madison wrote in The Federalist, the legislative authority, necessarily, predominates"" because it has access to the ""pockets of the people."" He warned that ""it is against the enterprising ambition"" of Congress ""that the people ought to indulge all their jealousy and exhaust all their precautions.""",OBJ,0_0
"Current climate models are overly damped and deterministic, focusing on the impacts of external forcing rather than simulating the natural internal variability associated with nonlinear interactions of the coupled atmosphere-ocean system, Curry said.",OBJ,5_1
"Nevertheless, it is absolutely clear that there is no evidence that there is a trend of growing extremes and more disasters, and that fits with what scientists have long said about global warming.",OBJ,1_7
"Since his election and subsequent re-election, Dr Pachauri has opened himself up to accusations of hypocrisy, urging the population to follow in his footsteps and become vegetarians to cut down on methane while at the same time travelling the world, clocking up environmentally unfriendly air miles.",OBJ,0_0
"Good people everywhere need to rise up, speak out and fight back, if they still believe in individual rights, freedom of thought and expression, and honest, transparent, trustworthy, accountable government and religious institutions. Otherwise, these fundamental values will disappear and with them will go modern society and living standards, and efforts to improve the lives of billions of people who still lack the lifesaving energy and technologies so many of us take for granted.",SUBJ,0_0
"If these findings hold true in humans, then a fathers diet and body composition at the time of conception is likely to affect his future childs health and risk of lifelong disease, said Tod Fullston, Ph.D., a researcher involved in the work from the Department of Obstetrics & Gynaecology at the Robinson Institute, Research Centre for Reproductive Health at the University of Adelaide in South Australia. Fathers should aim to be as healthy as possible at the time of conception to give future generations the best possible chance of good health.",SUBJ,0_0
August 2015 ENSO Update Another Westerly Wind Burst in Late July Should Help El Nio Evolve,SUBJ,0_0
"If this weather forecast showing sub-freezing temperatures in the Beaufort Sea is correct, alarmists are in a world of hurt.",OBJ,1_3
"Martin won't allow Canadian troops into Iraq to support a post-war fledgling democracy, but he'll send them into Sudan to prop up a post-democratic dictatorship in Canada. So, get out your scorecards. Now that Buzz Hargrove is Finance Motel Minister, and Kilgour is in charge of Foreign Affairs, Chuck Cadman should step up and take aim at the Defense portfolio. If the independant MP from British Columbia is a clever scamp, he'll announce to waiting reporters that he can support the Paul Martin Liberals - if he reverses the government's position on Canadian participation in Ballistic Missile Defense.",SUBJ,0_0
"A blog post about alarmist Richard Somerville is here . Excerpt: In an email exchange, I asked Dr. Somerville what he thought was needed in order to spark the changes the letter seeks. He responded, I think a dramatic shocking surprising climate event that is unambiguously due to global warming may be the only thing that motivates people and governments. Maybe a big chunk of ice sheet destabilizing and producing a significant sudden sea level rise. Unfortunately, then it may be too late, because its essentially irreversible; you cant cool the world enough to make the ice re-form quickly. Somerville was a member of an alarmist team that lost an NPR debate on global warming last March.",SUBJ,5_2
"The latest USA Global Forecast model shows a landfalling tropical cyclone near the Tampa are next week. The forecast position is shown above. If this verifies (as either a tropical storm or a hurricane), it will add another layer to what already will be an interesting potlical event!",OBJ,0_0
"Even if these women do exist, which is highly doubtful, EPA could not identify the supposed harm posed by U.S. power plants. EPA's modeling demonstrates that the 99th percentile pregnancy fish consumer (a hypothetical woman who eats almost 240 pounds of self-caught fish during pregnancy) would suffer a 0.8 IQ point loss in her fetus. But it is impossible to measure a fraction of an IQ point. That would be like using a cheap bathroom scale to measure one's weight to the hundredth of a pound.",OBJ,0_0
"In order to trsta their carbon faithful readers p Washington University's Zhang also says that when it gets warmer NNU's will probably trend seekers multitude of sea ice in Antarctica to be broken. The scheme will sledes to terstllas says Zhang, and politicians can continue to their climate policy threaten the safe frvissning that everything makes for hell unless they gr something drastically",OBJ,0_0
"Good evening ladies and gentlemen, welcome to SDA Late Nite Radio . Tonight, for your delectation and pursuant to our Tuesday night vintage music show, here are Harry Reser and his Syncopaters performing Shaking the Blues Away (1927, 2:49). Your Reader Tips are, as always, welcome in the comments.",OBJ,0_0
"The relationship is totally clear: The higher the share of wind and solar power in the power generation, the higher the electricity prices for consumers.",OBJ,4_4
"They threaten our most basic rights and freedoms, our political and scientific processes and ultimately our continued innovation and invention, energy reliability and affordability, job creation and economic growth, and modern living standards, health and welfare.",OBJ,0_0
"After a poll released this week showed President Barack Obama only beating his Democratic primary opponent John Wolfe Jr. by seven points, 45 percent to 38 percent, in Arkansas's Fourth Congressional District, state Democrats moved to practically disenfranchise Arkansas voters. elegates Wolfe might claim won't be recognized at the national convention,"" national party officials are telling state Democrats. Wolfe is being accused of not following the party rules. They want a coronation, Wolfe tells THE WEEKLY STANDARD. Theyre conflating with the party. Are we supposed to call him Dear Leader? Is this some kind of North Korea thing? Related! h/t Bemused""",SUBJ,0_0
"The Vaclav Klaus lecture yesterday was excellent - a very unpolitician-like politician, I thought, quietly spoken and with a complete lack of histrionics. This made him a very persuasive speaker I thought, and I would recommend you read what he has to say if you haven't already.",OBJ,0_0
"To be fair, President Xi had an inherent advantage during this recent trip Down Under. In addition to attending the G-20 meeting, the Chinese leader was there to sign the China-Australia Free Trade Agreement one hailed by many Australians as the most comprehensive FTA China has signed.",OBJ,0_0
"Postscript: As Kriegeskorte observed, the specific impact of an erroneous method on a practical data set is hard to predict. In our case, it does not mean that a given reconstruction is necessarily an ???artifact?? of red noise, since a biased procedure will produce a Stick from an actual Stick signal. (If the ???signal?? is a Stick, the biased procedure will typically enhance the Stick.) The problem is that a biased method can produce a Stick from red noise as well and therefore not much significance can be placed to a Stick obtained from a flawed method.",SUBJ,5_1
"Now, you say, this is the LA Times, so surely they would blame all this on global warming? And, of course, you would be right.",SUBJ,5_2
"Like the OPT report, this study does not recommend any coercive measures or legislation. Its looking at the potential for reducing carbon emissions by reducing the number of emitters. These are scientific papers: legislation is not their remit. Whats worrying is this new trend towards discussing children in terms of their emissions. Its the tacit and unspoken way that the equation of humans/gas is taken as somehow acceptable in modern society because of the supposed threat of global warming.",OBJ,0_0
Apparently you should abandon modernity so that fermented whale tail doesn't taste different,SUBJ,0_0
"???There have now been several major ice core surveys, and everyone of them says the same thing. CO2 clearly does not cause temperature changes, it follows temperature changes.??",SUBJ,2_3
