0,subjectivity,1
"Under the most optimistic computer model, periods of extreme heat would quadruple in Los Angeles by the end of the century, killing two to three times more people than in heat waves today; the Sierra Nevada snow pack would decline by 30% to 70%; and alpine forests would shrink 50% to 75%.",OBJ,0_0
lowering of Stevenson screen from 2.2 m to 1.5 m (June 1961).,OBJ,0_0
"?I never thought I would see this in my lifetime,? he said, sadness and anger competing on his face. ?The last time young people politicized and indoctrinated by the State broke up a meeting of their opponents here in Copenhagen by chanting mindless, repetitive slogans was during the Nazi occupation of Denmark during the Second World War.?",SUBJ,0_0
"For now, energy is carbon based because it is cheaper than anything else and it makes no sense to decarbonise unless everybody is doing it; it's lunacy to go it alone when China is building a new coal power station every week, he said, speaking at the LGA annual conference.""",OBJ,4_2
"The Obama administration?s record of bad loans to companies providing renewable power?wind and solar?is testimony to the waste of billions of taxpayer dollars. In September, the Department of Energy made $66 million in green-energy subsidies to 33 companies, half of it to companies by a single venture capital firm with close ties to the White House.",SUBJ,0_0
"While the excitement from solar proponents is palpable, it is surprising how shameless they are about sucking the government teat while bemoaning the low price of natural gaswhich Solar Industry Magazine calls a fly in the ointment"" and ""inconvenient."" It blames ""new technologies for oil and gas extraction"" (no wonder they keep trying to kill hydraulic fracturing). Gilpin states: ""in all its 1,560 pages, the Clean Power Plan doesn't directly address the actual deployment of solar photovoltaic (PV) systems. It does, however, give states and utilities an incentive to create and enhance mechanisms that will increase deployment of solar."" (Italics added)""",SUBJ,0_0
"Several recent papers have provided SLR numbers which need to be examined carefully in the context of present debate on global warmingand sea level rise. A paper by Holgate (2007, Geophysical Research Letters ) analyzed nine long and nearly continuous sea level records over one hundred years ( 1903-2003) and obtained a mean value of SLR as 1.74mm/yr, with higher values in the earlier part of the 20 th century compared to the latter part.",OBJ,1_6
"Not only are the 14 proxies used in O&B; not independent of prior studies, in fact, they are composed entirely of proxies repeatedly used in previous studies. Astonishingly, 2 of the 14 proxies (2 of only 10 in the Medieval Warm Period) are bristlecone/foxtail pines, despite the fact that these are precisely the proxies that have most been called into question in connection with the work of Mann et al.",OBJ,5_1
"To show how uncivil this crowd can get, Happer e-mailed me an article about an Australian professor who proposes quite seriously the death penalty for heretics such as Dyson. As did Galileo, they can get a reprieve if they recant.",OBJ,0_0
The evidence suggests that investing in affordable energy in Africa will not only achieve great good in itself but will equip Africans better to cope with dangerous climate change if it happens: weather-related mortality correlates with poverty. A survey of more than two million Africans finds that climate change comes dead last of 16 concerns they were asked about.,OBJ,0_0
"Molly: Well, it recognizes that the world is now dangerously overcrowded. Did you know there are now about 1 trillion of us? Experts at United Forests say we are now at the carrying capacity of the Earth. Each year billions of us die just due to overcrowding and competition for natural resources.",SUBJ,0_0
"The study adds to the major problems with wind, as compared with traditional sources of reliable power. Wind power: 1) is capital intensive major costs are up-front; 2) is erratic, requiring a dependable alternative when it fails (why not build a dependable alternative instead); 3) significantly increases infrastructure cost for the collection and balancing system (grid); 4) lowers the capital recapture of the dependable alternative, thereby jeopardizing its credit worthiness and increasing its costs; and 5) has a short life, requiring significant replacement costs. Please see links under Questioning European Green.",OBJ,4_4
"Thinking of this horrific, apocalyptic scenario makes it difficult for Bry to decide whether to sire another child Bry is already a father to an 11-year-old son.",OBJ,0_0
UPDATE: 9:55 AM PDT 8/8/12 A graph of Palmer Drought Severity Index -vs- GISTEMP data has been added from Dr. Michaels. Looks like another GISS miss.,OBJ,0_0
Due to the lack of actual extreme weather (record low tornadoes and hurricanes in the US) climate charlatans now describe mild weather as extreme.,OBJ,1_7
"Perhaps in England, where Simpson resides, this trickled down version only manifests itself in the spornosexual,"" with all its implications of being more couture and less college frat house. But a sweeping visual of America's sidewalks, cubicles, gyms, and watering holes indicates that the phenomenon has trickled down into a second, less posed, much more familiar, and seemingly harmless, form. This second form often looks awfully similar to a superannuated frat boy, and smells remarkably similar to the ""bro.""",SUBJ,0_0
"Since 2008, in the western part of Texas, fully 10 percent of the time wind operators paid the electrical grid to take their electricity.",OBJ,4_4
"Not too mysteriously, manmade greenhouse gases have had little impact on two (overlapping) portions of the largest ocean on the planet.",OBJ,2_3
"Friends of Science are concerned about fair reporting on climate change in the media, in light of reports the British Broadcasting Corporation reportedly spent some 20,000 over six years fighting off a Freedom of Information request about a 2006 climate change conference for executives, as reported in the Daily Telegraph of the UK Jan. 12, 2014 and several British newspapers.",OBJ,5_2
"In February 2012, Time's Bryan Walsh broke news that Chesapeake Energyone of the largest natural gas companies in North Americagave $26 million to the Sierra Club from 2007 to 2010. Walsh reports that the donations helped fund the Sierra Club's Beyond Coal"" campaign, the avowed purpose of which is to eliminate coal-fired electricity in America. Chesapeake Energy's $26 million in donations was a significant component of Sierra Club's total revenues during that period. The Sierra Club's total assets were $50 million in 2010, according to Politico.""",OBJ,0_0
"The answer and, as I shall show, it is the right one is that his deliberately dishonest personal attack on my integrity and reputation is an ingenious fiction, he knows it, and he has therefore had to go to some elaborate and time-consuming lengths to conceal the steps he has taken to hide the truth and make this nonsense look plausible.",OBJ,0_0
"If cost issues weren't enough to make you a wind energy opponent, think of the health issues.",OBJ,0_0
"on Wednesday, September 21st, 2011 at 3:47 pm and is filed under Uncategorized.",OBJ,0_0
"The second example comes from some of my experiences in the medical field. Although I am retired from active medical practice, I still do electrocardiogram (ECG) interpretations for the hospital where I used to practice. I have been doing this for about forty yearsas a sideline when I had an active practice and now as my sole medical activity. Currently I read 90-100 ECGs per day. Over the years, I would estimate that I have read well over a million. So I know more than just a little about this one specialized area of cardiology.",OBJ,0_0
"The temporal extent of modern observations is too short to properly measure natural ENSO variations: averaging together at least 200 years is required to obtain robust ENSO statistics in a stable climate . Using paleoclimateproxies to extend the observational record is another option, but is complicated by the uncertainties involved in translating between model and proxy signals. Coral oxygen isotopes, the most commonly used ENSOproxy, are shown to be governed by nonlinear dynamics: a more accurate forward model or coral 18Ois needed. Even using such a model, at least 4-5 contemporaneous records will be required for accurate ENSO amplitude estimation.",OBJ,5_1
"On April 1, the California Senate's Environmental Quality Committee approved a bill that would limit carbon dioxide emissions from car tailpipes on a 5 to 2 party-line vote, with Democrats voting in favor and Republicans against. The bill passed the California Assembly on January 31.",OBJ,0_0
"Rs who strongly feel the impulse to do somethingneed merely wait untilJanuary 2011, when they are widely expected to hold more seats in both the House and Senate, and when Waxman-Markey will no longer be in play.",OBJ,0_0
"But according to the FSHP, the only way a Cuban can get access to the hospital is through a bribe or contacts inside the hospital administration. Cubans are reportedly very resentful that the best hospital in Havana is 'off-limits' to them,"" the memo reveals.""",OBJ,0_0
"Perhaps they refer to periods mentioned by the Climatic Research Unit (CRU) in an information leaflet that was available on their pre-climategate web site, where they acknowledged earlier warm periods in the Central England Temperature record, but didnt explain the lack of a CO 2 link. However that would produce difficulties for the theory, so maybe not. One wonders what time period the 76 specialists out 79 thought they were answering yes to.",SUBJ,0_0
"You may clearly see these things in the movie. They couldn't really fake movies well at that time. Why would you doubt it? Some people want to protest against a bullet that goes through both bodies. But what's so shocking about it? When one body is behind another, and it clearly was from that angle (it is not too unlikely in a car, anyway), a shot simply gets through both bodies.",SUBJ,0_0
"As has been shown time after time, the private market, when allowed to function, works much better than an overregulated industry. Moving the state into the middle of the electric market will only create a host of new problems. The state cannot build power plants faster, cheaper, or more efficiently than the private sector. The state cannot set prices better than the private sector. The state can, however, spend the taxpayer's money faster than the taxpayer could. Other states, such as Pennsylvania, and other countriesEngland, for examplehave made a success of electrical deregulation. California could too. But it must allow the market to work.This essay originally appeared in the San Jose Mercury News, January 23, 2001. Available from the Hoover Press is In Sickness and in Health: The Kyoto Protocol versus Global Warming, by Thomas Gale Moore, part of the Hoover Essays in Public Policy series. To order, call 800-935-2882.",SUBJ,0_0
Who knows? Maybe even Sarah Jessica Parker will someday come around. Even if her relatives do lose their government aid.,SUBJ,0_0
"Lgenergilampor are additionally not so effective as they often pretends for being, tells Jonas and Ida. The fact is that a lgenergilampa mrkt 14 W frbrukar energy equivalent to up to 38 W p because of a fasfrskjutning. This causes fasfrskjutning energifrluster the mains, DRMed's case this frbrukning not elrkningen p.",OBJ,0_0
"The Affordable Power Alliance will urge the new Congress to honor its constitutional duties, and prevent the Obama administration from imposing excessive regulations inspired by extreme ideologies. Congress, including Democrats up for reelection in 2012, needs to heed the overwhelming public demand that America's economy no longer be held hostage by an elitist environmental network even if that network includes the President of the United States.",OBJ,0_0
"Since just before the start of the 21st century, the Earths average global surface temperature has failed to rise despite soaring levels of heat-trapping greenhouse gases and years of dire warnings from environmental advocates.",OBJ,1_4
"Roy, a Ph.D economist who has been dragged through the ad hominem mud , is right to put the onus on David Appell now that the latters fishing expedition backfired rather badly. One might also challenge Joe Romm, the bully of bullies as documented at the Breakthrough Institute by Michael Shellenberger and Ted Nordhaus .",OBJ,5_2
"CSIRO have produced the most precise record of greenhouse gas fluctuations in the Southern Hemisphere over the past 2000 years. They add that the greatest increase in greenhouse gas growth has occurred since the 1980s, with carbon dioxide showing accelerating growth. Other CSIRO researchers such as Penny Whetton warned of changes to extreme weather more heatwaves, floods, droughts and more intense tropical cyclones. CSIRO are also investigating how climate change interacts with natural short, medium and longer term cycles.",OBJ,0_0
"A team led by University of Maine scientists has reported finding a potential link between changes in solar activity and the Earths climate. In a paper due to be published in an upcoming volume of the Annals of Glaciology, Paul Mayewski, director of UMaines Climate Change Institute, and 11 colleagues from China, Australia and UMaine describe evidence from ice cores pointing to an association between the waxing and waning of zonal wind strength around Antarctica and a chemical signal of changes in the suns output.",OBJ,2_1
"The public comments submitted by CEI further delve into the legal conflicts presented by the Clean Power Plan. For example, EPA is playing fast and loose with the statute because commercial technologies to capture or filter CO2 from existing power plants have not yet been developed.",OBJ,0_0
"Jan Rovensk, Czech Greenpeace Climate Boss, on the left, one of his comrade on the right, and your humble correspondent in the middle.",OBJ,0_0
The figures suggest that we could even be heading for a mini ice age to rival the 70-year temperature drop that saw frost fairs held on the Thames in the 17th Century.,OBJ,1_2
How the Center for American Progress campaigned to suppress speech,OBJ,0_0
"How diametrically different is then the attitude and phrases of our president, Milo Zeman, who despite a massive wave of outrage in the U.S. and Brussels, and indignation by the pro-American sold fifth column"" formulates the things as they are, uses the right names to call things, and localizes the genuine culprits and causal relationships and who isn't afraid that Europe also includes Russia but not the U.S... and other facts. I respect Zeman for those reasons and I encourage all those who care about the fate of our country and ourselves to loudly express their lasting support against ""the American practices of CIA realized not only by the U.S. Ambassador Andrew Schapiro"", against the red cards of the traitors from the Prague cafs, and against the policies of the ""sycophants in Brussels"". He is a directly elected president of ours, so we shouldn't let anyone take him away from us...""",SUBJ,0_0
Link to the paper from skyfall is to an authors copy and is broken. Ive dug out a proper copy.,OBJ,0_0
"Rather than thinking that humans have the power to create a better world, they are viewed as potential destroyers. In this misanthropic worldview, humans essentially become parasites on the planet. They are portrayed as destroyers of the environment and creators of waste, rather than as being capable of achieving great things. Rather than highlighting human ingenuity, the emphasis is on the destructiveness of mankind.",OBJ,0_0
"All gases in the atmosphere have an effect on global climate, usually a moderating one, reducing the intense heat of the midday sun and reducing the rate of cooling at night. But only in theoretical climate models does carbon dioxide drive global warming ??? real evidence contradicts them.",SUBJ,2_3
"But considering how much attention would have been lavished on a comparable run of hot weather or on a warming trend that was plainly accelerating, shouldnt the recent cold phenomena and the absence of any global warming during the past 10 years be getting a little more notice? Isnt it possible that the most apocalyptic voices of global-warming alarmism might not be the only ones worth listening to?",SUBJ,1_4
Remember when this kind of thing was routinely featured on front pages?,SUBJ,0_0
and it lets you pick any of 3 major temperature points for your type of crop and see a map of Washington State for degree days to date. OR the variance from the 30 year average. This is the deviation chart:,OBJ,0_0
"Hitherto economic analysis of climate change has concentrated on what the Kyoto Protocol compliance costs might be, a subject that is not part of the IPCC process at all, while most attention on the IPCC process has been directed to narrowing the uncertainties of the climate models themselves. An independent economic analysis of the front end of the climate change process would be a useful starting point for finance ministries or a Team B to enter the fray.",OBJ,0_0
Alternative Headline: Guy wastes power to protest wasting power:,OBJ,0_0
"Elevated CO 2 suppressed foliar injury caused by elevated O 3 , especially in some of the more O 3 -sensitive cultivars used in this study. In addition, atmospheric CO 2 enrichment to 700 ppm almost completely protected such cultivars from the negative effects of elevated O 3 on seed yield. At ambient CO 2 concentrations, for example, elevated O 3 reduced seed yield by 48% in an O 3 -sensitive cultivar. However, at an atmospheric CO 2 concentration of 700 ppm, yield reductions in this same O 3 -susceptible variety were only 8%. Thus, atmospheric CO 2 enrichment had a strong ameliorating effect on the negative influences of elevated O 3 on growth and yield of O 3 -susceptable winter wheat cultivars.",OBJ,3_2
No evidence exists that suggests that both bears and the conservation systems that regulate them will not adapt and respond to the new conditions. Polar bears have persisted through many similar climate cycles.,OBJ,3_2
"Let us remind ourselves that the crude oil we recover from under our feet is neither foreign nor man-made, nor is it artificial. It is produced entirely by Mother Nature who occasionally spills it. Frequently spills it.",OBJ,4_5
"The climate change community"" went straight into full reality denying mode.""",OBJ,0_0
"Also, during multidecadal periods when La Nia and El Nio events are more evenly matched, as they have been for the past decade, atmospheric and ocean circulation become more balanced, leading to the cessation of the long-term, naturally caused, sunlight-fueled global warming.",OBJ,2_1
Australias antarctic runway melting | Central Midlands & Coastal ...,OBJ,0_0
"In the recent blog post Climate indices to watch at RealClimate , contributor Rasmus Benestad writes (my boldface):",OBJ,0_0
"Update: Eli Rabett observed that another description of the adjustments, additional to the link that I provided above, is here and states that:",OBJ,0_0
"This would mean global temperatures have not risen since 1998, prompting some to question climate change theory.",OBJ,1_4
"The intolerance, of course, stems from the realization on the part of those behind the ?global warming? scam that it is entirely false. It is always liars who have to shout loudest in the hope of temporarily prevailing over the truth.",SUBJ,5_2
> >> Climatic Research Unit fax: +44 1603 507784,OBJ,0_0
"These groups are currently running a massive campaignin Texas to prevent the building of new coal-fired plants, without which the state will be patently unable to meet its needs. Transmission lines face even worse obstruction.",OBJ,0_0
"The Guardian tells us that Bjorn Lomborg, ?The world?s most high-profile climate change sceptic is to declare that global warming is ?undoubtedly one of the chief concerns facing the world today? and ?a challenge humanity must confront?, in an apparent U-turn that will give a huge boost to the embattled environmental lobby.? The problem is it is completely false. His message on climate in his new book is exactly the same as it has been all along.",SUBJ,0_0
Figure 1.) Photo of the Western Pacific Ocean Kavachi sub-marine Volcano eruption plume as it breaks through to the surface (January 2014).,OBJ,0_0
"If a single simulation is not a good predictor of reality how can the average of many simulations, each of which is a poor predictor of reality, be a better predictor, or indeed claim to have any residual of reality?",SUBJ,5_1
is about +1.5 deg C above the 1961-90 average,OBJ,0_0
"In comments, boballab posted a link to a picture of the undersea topology with volcanoes marked.",OBJ,0_0
"So far, so good, but as we know that temperature of the earth can and does vary independently of CO2 concentrations, how do you know that the rise was due to CO2 alone? And if it wasnt, then in fact you may have overshot or undershot by more than the 0.5 degrees. If you overshot, your modelling was completely unsuccessful, and if you undershot, then things are a lot worse than you thought.",SUBJ,0_0
"IER's Kish deemed the climate report a scare tactic designed to excuse the President's agenda of centralizing power in Washington and making energy more expensive and jobs harder to find.""",OBJ,4_1
"23 Edward Luttwak, The Middle of Nowhere,"" Prospect (May 2007); James Zogby, ""Arab Attitudes in 2005,"" Arab-American Institute; Joseph Joffe, ""A World Without Israel"" Foreign Policy (January/February 2005); Eytan Gilboa, ""Public Diplomacy: The Missing Component in Israel's Foreign Policy,"" Israel Affairs (October 2006).""",OBJ,0_0
"1. When compared with pre-1800s levels do you think that mean global temperatures have generally risen, fallen, or remained relatively constant?",SUBJ,0_0
"First, slaves and fossil-fuelled machines play(ed) similar economic and social roles: energy slaves (machines powered by fossil fuels) now do the work in our homes, fields and factories, which used to be carried out by slaves and servants in the past. Both slave societies and developed countries externalise(d) labour (labour came from slaves in the former case and work is provided by machines in the latter), and both slaves and modern machines free(d) their owners from daily chores.",OBJ,0_0
The really funny thing is that Holman's complaint about my,OBJ,0_0
"And the report does not mention the smell. And not any other potential side effects. What about the bugs? At least on humans, garlic is believed to be a repellant. Will this in turn affect the bird life? Guess a new bunch of money would be welcome, before the entire idea is picked up by the Comission, for a garlic cow directive.",SUBJ,0_0
"The five researchers report that changes associated with both management, its absence, and the 1998 ENSO were found, but they say that the changes were generally small and that ecological measures indicated stability or improvements over the period of their study. In fact, they state that northern Tanzania reefs have exhibited considerable resilience and in some cases improvements in reef conditions in the face of dire global predictions for overfishing, climate change, and their interaction.",OBJ,3_2
L1734 0.7 L1830 0.4 H1253 6.1 H1336 6.1 H1415 6.1 H1451 6.1 H1524 6.0,OBJ,0_0
Court accuses EPA of filibustering on pesticide safety,OBJ,0_0
He further states that A much misunderstood phenomena is global climate change. He discusses the complexity of climate change which has not been properly communicated to politicians.,OBJ,0_0
"However, Im now fairly confident that cooling is more likely than warming over the next few years and as I looked to see when we might begin to see cooling, a rather ironic scenario occurred to me:",OBJ,1_2
"The Sierra Club, however, criticized Obama saying As long as his administration keeps throwing lifelines to old sources of energy like oil and gas, we won't be able to lead the world on clean energy solutions like wind and solar."" They called for an ""end to oil and gas fracking on public lands."" What they are not saying is that the Obama Administration has virtually put an end to any exploration and extraction of energy sources on public lands. And you can forget about the massive reserves estimated to exist off-shore of our coasts.""",OBJ,0_0
"If I can restore the computer from its current paperweight status, the round-up will happen tomorrow.",OBJ,0_0
"In the May 2000 issue of Reason Magazine, award-winning science correspondent Ronald Bailey wrote an excellent article titled Earth Day, Then and Now"" to provide some historical perspective on the 30th anniversary of Earth Day. In that article, Bailey noted that around the time of the first Earth Day, and in the years following, there was a ""torrent of apocalyptic predictions"" and many of those predictions were featured in his Reason article. Well, it's now the 46th anniversary of Earth Day, and a good time to ask the question again that Bailey asked 16 years ago: How accurate were the predictions made around the time of the first Earth Day in 1970? The answer: ""The prophets of doom were not simply wrong, but spectacularly wrong,"" according to Bailey. Here are 18 examples of the spectacularly wrong predictions made around 1970 when the ""green holy day"" (aka Earth Day) started:""",SUBJ,0_0
Id really like to see Al Gore sitting down on that rug with those kids. He might learn something.,OBJ,0_0
