0,subjectivity,1
Expect Pelosi to cave and permit the farm lobby to write an amendment to the bill that forces the EPA to exclude indirect emissions from its calculations. That would saddle American consumers with a climate bill to raise their utility bills and more ethanol to inflate the price of food and fuel.,OBJ,0_0
"What this means, is that if the modeled temperatures were also stripped of their natural variability, then the 95% range of uncertainty (the yellow area depicted in Fig. 2) would contract inwards towards the model mean (green line). The net effect of which would be to make the observed trends (red and blue lines in Fig. 2) over the past 30 years or so lie even closer to (if not completely outside of) the lower bound of the 95% confidence range from the model simulations. Such a result further weakens our confidence in the models and further strengthens our confidence that future warming may well proceed at a modest rate, somewhat similar to that characteristic of the last three decades.",OBJ,5_1
Government eyes crippling climate-control measures,OBJ,4_1
Last week we talked about Clouds and some climate guys who cant decide if clouds are a forcer or an inhibitor.,OBJ,0_0
"To borrow a phrase from Administrator Spalding, to choose latter will be painful, painful every step of the way"" for their constituents. I hope they make the right choice. With that Mr. President, I yield the floor.""",OBJ,0_0
"I may be wrong, but in my opinion, the averaging over multiple data sets is better than relying on only one.",OBJ,0_0
"Following the early Holocene warming Siple Dome data indicate significant cooling between 6400 and 6200 years ago, followed by relatively milder temperatures over East Antarctica 6000 3000 years ago that lasted until about 1200 years ago in the Siple Dome area. There then seems to have been a flattening and a slight decline in temperature starting 1200 1000 years ago, followed by warming in the last few decades.",SUBJ,0_0
"The Chinese deserve our thanks for standing firm and refusing to join in the folly. Understanding that this was nothing but a plan to curtail economic growth, they told U.S. officials to come back and see them in fifty years.",OBJ,0_0
"Campbell, I.D. and Flannigan, M.D. 2000. Long-term perspectives on fire-climate-vegetation relationships in the North American boreal forest. In: Kasischke, E.A. and Stocks, B.J. (Eds.). Fire, Climate Change, and Carbon Cycling in the Boreal Forests. Springer-Verlag, New York, New York, USA, pp. 151-172.",OBJ,0_0
"FURTHER READING: DeLong recently wrote Opening a Can of Worms: Government and Climate Change Data."" He also discussed the failure of Congress and the administration to encourage biotech investment in ""Bleeding Biotech,"" and ""The Coming of the Fourth American Republic"" after America's special interest state decays. Kenneth Green dissects Climategate in ""The Meaning of Motley CRU"" and responds to Sen. John Kerry's climate claims in testimony before the Senate.""",OBJ,0_0
"GT is safe njda with his little PR stunt, but are they aware that the flesh stands for more than 18 percent of global koldioxidutslppen and medium Svensson klimatpverkan depends to 25 percent on our eating habits?",SUBJ,0_0
The STOCK Act and the SECJohn Berlau's op-ed in National Review,OBJ,0_0
"Giant hurricanes are rare, but they are not new. And they are not increasing. To the contrary. Just go to the website of the National Hurricane Center and check out a table that lists hurricanes by category and decade. The peak for major hurricanes (categories 3,4,5) came in the decades of the 1930s, 1940s and 1950s, when such storms averaged 9 per year. In the 1960s, there were 6 such storms; in the 1970s, 4; in the 1980s, 5; in the 1990s, 5; and for 2001-04, there were 3. Category 4 and 5 storms were also more prevalent in the past than they are now. As for Category 5 storms, there have been only three since the 1850s: in the decades of the 1930s, 1960s and 1990s.",OBJ,1_7
"Was the division between conventional and unconventional oil devised to cover up the failure of the peak oilers? No way. The distinction is useful in a variety of ways for analyzing the world of oil sources. I think that the concept was simply appropriated by the peak oilers because it was very useful to them, since it totally obscured the failure of their peak oil predictions. To me, oil is oil is oil, and if you claim the world will run out of oil, you cant later say that you have redefined things, and that the oil that proves your prediction wrong is some other special kind of oil that doesnt count as oil but walks like oil and quacks like oil ...",SUBJ,0_0
"Question 5 (for Peter Calamai or Lucinda Chodan): There has never been, to my knowledge, a full-dress debate on any of the major Canadian television networks on the question of global warming, in part, I gather, because AGW supporters do not want to give the skeptics credibility."" If the AGW hypothesis is as ""certain"" as its supporters believe, why not have such a debate, or a series of them, and crush the skeptics once and for all?""",SUBJ,0_0
CEI Expert Available to Comment: Director of Global Warming Policy Myron Ebell on last year's climate pact with several Asian nations:,OBJ,0_0
"The NCDC data are regularly used by the National Weather Service to declare a given month or year as setting a record for warmth. Such pronouncements are typically made in support of the global warming alarmism agenda. Researchers who support the United Nations' Intergovernmental Panel on Climate Change (IPCC) also regularly use the NASA/NCDC data, including researchers associated with the Climatic Research Unit at the University of East Anglia that is now at the center of the Climategate"" controversy.""",OBJ,5_2
"The third fact is that also the amount of CO2 in the atmosphere fluctuates in time, sometimes precedes, sometimes follows the temperature increase, and that ? with all the problems of not fully compatible time series ? in the last two centuries we witness a mostly anthropogenically enhanced amount of CO2 in the atmosphere. Its concentration increased from 284.7 ppmv in the year 1850 to 310.7 in the year 1950, and to 387.3 in 2009.",SUBJ,0_0
"There are still some puzzles in the next step of this beauty contest. The submission included two series from one Quelccaya ice core ??? one for dO18 and one for accumulation. Did these two series from the same ice core ???represent different parts of the globe??? Maybe one of the series ???represented?? northern Sweden? Or Australia? Or Crawford, Texas? Or Minneapolis? He had 4 different bristlecone and foxtail series, including series only a few tens of miles apart. Did these ???represent?? different parts of the world through Mannian teleconnection? Maybe the Upper Wright Lakes foxtails represented Poland, Boreal foxtails Afghanistan, the Methuselah Walk bristlecones Thailand and the Indian Garden bristlecone the South Atlantic? IT sounds silly expressed like this, but the assumptions of the ???model?? do not preclude this.",SUBJ,5_1
"The intolerant Left is killing free speech,"" says liberal commentator Kirsten Powers. It is committed to tolerance, pluralism and reasoned debate only for itself, and only to advance its agenda. Otherwise, it applies ""authoritarian demands for intellectual conformity,"" and relentlessly vilifies and tries to silence anyone who speaks up, asks inconvenient questions or challenges the ""progressive"" worldview.""",OBJ,0_0
"Nicola Scafetta has a paper suggesting that a model based on the movement of the planets (planetary orbital oscillations) better explains climate variation than the General Circulation Models used by the UN IPCC. On her web site, Jo Nova has a good presentation of the paper and a number of useful comments. The descriptive power of the model may be just a statistical artifact, but it may promote useful discussion.",OBJ,2_1
The answer lies in his promise to ?fundamentally transform? a nation that does not need transformation except for the reduction of the size and scope of the federal government. Its economic system is the best in the world. Its military is the strongest. Its agriculture feeds Americans and is exported to other nations.,SUBJ,0_0
"For examples of recent estimates of climate sensitivity see Nicholas Lewis, An Objective Bayesian Improved Approach for Applying Optimal Fingerprint Techniques to Estimate Climate Sensitivity,"" Journal of Climate, Vol. 26, No. 19 (October 2013), pp. 74147429; Alexander Otto et al., ""Energy Budget Constraints on Climate Response,"" Nature Geoscience, Vol. 6, No. 6 (June 2013), pp. 415416; Magne Aldrin et al., ""Bayesian Estimation of Climate Sensitivity Based on a Simple Climate Model Fitted to Observations of Hemispheric Temperatures and Global Ocean Heat Content,"" Environmetrics, Vol. 23, No. 3 (May 2012), pp. 253271.""",OBJ,0_0
"This chart is a real head-scratcher for scientists trying to prove a causal relationship between CO2 and global temperatures. By theory, temperature increases from CO2 should be immediate, though the oceans provide a big thermal sink that to this day is not fully understood. However, from 1880 to 1910, temperatures declined despite a 15ppm increase in CO2. Then, from 1910 to 1940 there was another 15ppm increase in CO2 and temperatures rose about 0.3 degrees. Then, from 1940-1979, CO2 increased by 30 ppm while temperatures declined again. Then, from 1980 to present, CO2 increased by 40 ppm and temperatures rose substantially. By grossly dividing these 125 years into these four periods, we see two long periods totaling 70 years where CO2 increases but temperature declines and two long periods totaling 55 years of both CO2 and temperature increases.",SUBJ,2_3
"We are almost half way through his 60 year, 1,000 mm forecast and sea level has risen zero mm near Canberra. Only 1,000 mm left to go in the next 30 years.",OBJ,1_6
"The reduction of greenhouse gas emissions in the U.S is largely a result of a poor economy, a rise in the use (and affordable availability) of natural gas, and on-going improvements of the U.S. energy efficiency that were begun long before the Obama Administration.",OBJ,4_2
The Canadian statistics expert also writes that the proxies that Mann and Rahmstorf used do not contain any useful information on the past history of the AMOC .,OBJ,5_1
I fear that we??re headed into such a period of great cooling and repetitive catastrophic flooding right now.,SUBJ,1_2
"I dont want to blame them, but typically the working group reports are managed by the co-chairs. Of course, the chair is there to facilitate things, but we have substantial amounts of delegation, Dr Pachauri said.",OBJ,0_0
"Lindzen thinks the true number is closer to -1, which is similar to the number I backed into from temperature history over the last 100 years . This would imply that feedback actually works to reduce the net effect of greenhouse warming, from a sensitivity of 1.2 to one something like 0.6C per doubling.",OBJ,3_1
"Now, because there never was anyone hollering about peak coal, theres no such thing as unconventional coal, despite huge changes in mining technology. Coal mining has changed as much or more than drilling for oil so why isnt there unconventional coal?",SUBJ,0_0
"with the most pronounced warming obviously in the Arctic, in stark contrast to the DMI data and the NASA/GISS Greenland Godthab weather station (graphs above, which is the only station in operation for Greenland during the entire 1881-2009 period)(the second longest running Antarctic station Angmagssalik also shows no significant change in temperature 1895-2009).",SUBJ,0_0
Yesterdays print edition of Germanys high-brow weekly Die Zeit has a full three-page feature story on thegrowing climate science skepticism in the USA and Germany titled The Climate Warriors authored by Kerstin Kohlenberg and Anita Blasberg.,OBJ,0_0
"Let me re-state my view on these temperature series again: personally I have no doubt that temperatures are warmer today than in the 19th century. Are they warmer than the 11th century? I dont know. Is it warmer now than the 1930s? Probably, but the size of the difference seems to depend to an alarming extent on adjustments. Thats not to say that the adjustments are wrong, but, if one is going to rely on specific estimates of the difference, one needs to understand the nitty-gritty of the adjustments that underpin the conclusion and why the adjustments are so different between KNMI, GISS and GHCN.",SUBJ,5_1
"For most economic sectors, the impacts of drivers such as changes in population, age structure, income, technology, relative prices, lifestyle, regulation, and governance are projected to be large relative to the impacts of climate change",OBJ,0_0
This was the moment when the rise of the oceans began to slow and our planet began to heal.,OBJ,0_0
"Firstly, hundreds of tide gauges show sea level rising at about a third of the rate than satellites do . Worse, the original satellite raw data showed the same slow rise, until it was suddenly adjusted. The real scandal is that the rapidly rising trend was largely created by adjustments in the first place. These latest corrections just adjust down part of the rate which had been created by adjusting up. On top of all that, the long paleo-history of sea levels done by people like Nils-Axel Mrner show that the current rise is not unusual or unprecedented at all. Could it get more pointless? It can: the acceleration Watson et al found is so small its less than the errors. (See the graph below).",SUBJ,5_1
"Additionally, when methane cannot be captured and put in a pipeline destined for market, it is burned, or flared, at the wellhead, producing carbon dioxide and water. Pretending these technologies do not exist and that these mitigation procedures are not widely practiced is a dishonest depiction of methane emissions. Recent scientific studies have found much lower methane emissions than were reported by McKibben.",OBJ,0_0
"CEI Expert Available to Comment: Senior Fellow Eli Lehrer on Castro's presidential legacy: While centrally planned communism has never helped any nation's economy in the long run, Cuba seems to have had it particularly bad: Between World War II and the 1960s, indeed, communist Eastern Europe rebuilt at roughly the same rate as the West only to see economic growth nosedive after that. Cuba, on the other hand, has seen its living standard drop from the third highest in the Americas (after the U.S. and Canada) to one of the lowest.""",SUBJ,0_0
"You'll do more than pay lip service to saving the planet with your purchase of Lip Action. One dollar of each $3.49 sale of Kiss My Face's Lip Action line of lip balms supports the Alliance for Climate Protection , founded by Nobel Peace Prize-winner Al Gore. With eco-aware names like Berry Warm and Glacial Mint, the SPF 15 balms shield against the blast of UV rays while aloe and cocoa butter help smooth and soothe. kissmyface.com",OBJ,0_0
"In the Assessment's 1200 horror-studded pages, almost everything that happens in our complex world sex, birth, disease, death, hunger, and wars, to name a few is somehow made worse by pernicious emissions of carbon dioxide and the joggling of surface average temperature by a mere two degrees.",OBJ,0_0
"FactCheck: The lead author of the Antarctica study, University of Missouri professor Curt Davis, said : These television ads are a deliberate effort to confuse and mislead the public about the global warming debate. They are selectively using only parts of my previous research to support their claims."" Davis's study indicated the increased ice accumulation in the interior might be offsetting the loss of ice at the coastal regions, or might not. It said that whether the entire ice sheet is shrinking ""will depend on the balance between mass changes on the interior and those in coastal areas.""",OBJ,0_0
"Longtime MasterResource readers know of Chip Knappenberger??s post on the negligible climatic effects of unilateral adherence to Waxman-Markey. Across the board, the response from supporters of Waxman-Markey was not to deny Knappenberger??s calculations, but rather to insist that the U.S. had to show leadership. The (perhaps unspoken) premise was that if the whole world adopted the steep emission cuts proposed in Waxman-Markey, then the climatic benefits would clearly outweigh the economic costs.",SUBJ,4_2
"Moreover, measurement of carbon content, which would be required for tariffs or sanctions to be implemented, is costly. Most major products include components from many different countries involving many different production practices. Which ones should be the benchmarks? It seems obvious that there is great potential for protectionism and the loss of the many gains generated by international trade.",SUBJ,0_0
"Climate realists have long been aware that global average surface temperature had stopped sometime around 2000, and even a few years before. Lately alarmists had to admit it . The period with no warming is now as long as was period of warming on which fears were based 17 years according to a leaked draft of the Intergovernmental Panel on Climate Changes (IPCC) Fifth Assessment Report (AR5)despite continued rise of atmospheric carbon-dioxide concentration.",OBJ,1_4
"To obtain a PSD permit,firms mustdocument their compliance withbest available control technology (BACT) standards.Even apart fromany technology investments needed to comply with BACT, the PSD permitting process is costly and time-consuming. In 2007, each permit on average cost $125,120 and 866 burden hours for a source to obtain, and $23,280 and 301 hours for EPA or a state agency to process, EPAestimates .No smallbusiness could operate subject to the PSD administrative burden.",SUBJ,0_0
"The updated outlook also lowers the overall expected storm activity this season. The outlook now includes a 70 percent chance of 6-10 named storms (from 6-11 in the initial May Outlook), of which 1-4 will become hurricanes (from 3-6 in May), and 0-1 will become major hurricanes (from 0-2 in May). These ranges ??? which include the three named storms to-date (Ana, Bill, and Claudette) ??? are centered well below the seasonal averages of 12 named storms, 6 hurricanes and three major hurricanes.",SUBJ,1_7
"Since even immediate and total shutdown of all carbon dioxide-emitting vehicles, power plants, and factories in the U.S. would decrease global warming by only a hypothetical and undetectable two-tenths of a degree Celsius by 2100, it is misleading to imply, as the report does, that the Obama administration's climate policies can provide any measurable protection from extreme weather events.",OBJ,4_2
The feds prefer front-loading washing machines. Government studies conclude that these horizontal axis designs like the machines in Laundromats consume less energy and reduced energy use means reduced carbon dioxide emissions.,OBJ,0_0
"CEI, a non-profit, non-partisan public policy group founded in 1984, is dedicated to the principles of free enterprise and limited government. For more information, please contact the media relations department at pr@cei.org or 202-331-1010.",OBJ,0_0
"Temperature adjustments such as those due to change in instrumentation are, of course, necessary. However, the results shown in this paper demonstrate that the lack of correctly and consistently sited stations results in an inherent uncertainty in the datasets which should be addressed at the root by documenting the micrometeorological deficiencies in the sites and by adhering to sites which conform to standards such as the GCOS Climate Monitoring Principles ( http://gosic.org/GCOS/GCOS climate monitoring principles.htm ). A continued mode of corrections using approaches where statistical uncertainties are not quantified is not a scientifically sound methodology and should be avoided, considering the importance of such surface station data to a broad variety of climate applications as well as climate variability and change studies.",SUBJ,5_1
But this jet stream is also bringing dry air from eastern Africa right up into Russia and this continuous heatwave is allowing the wildfires to build.,OBJ,0_0
"A defining characteristic of Simpson's Spornosexual Man is his proclivity to swap the high-end urban mallthe metrosexual's havenwith the gym. It's not just as superficial a link as Mr. Spornosexual pumping iron next to the bro"" in the gym that marks the two of them as offspring of the same parent. Both are overwhelmingly single, younger, professionals, and urban dwellers. But where the metrosexual has seen well-cut and expertly tailored clothes as a visual art experience to patronize as also to indulge in, the two iterations of the spornosexual see clothes as a fine indulgence of frivolity compared to the art of their own body, which is best exhibited nude. Or nearly nude.""",OBJ,0_0
"To stay warm, thousands of elderly are using travel passes to ride buses all day, while others seek refuge in libraries and shopping centers, the Sunday Express noted. Others are putting their health at risk, in an attempt to keep costs down,"" by bundling up and turning the heat down or off entirely, said Age UK Charity Director Michelle Mitchell.""",OBJ,0_0
"This finding, as they astutely state, may question the common belief that frequency and severity of such events closely relates to climate mean states,"" which conclusion essentially rebuffs the well-worn climate-alarmist claim that global warming will lead to more frequent and severe floods and droughts. The odds are that if global warming didn't do so over the past thousand or more years, it likely won't do so in the future.""",OBJ,1_7
"This social pessimism has emerged over several decades. Its roots can be seen in the counterculture of the 1960s when the political Left, traditionally the most ardent supporters of social change, began to embrace green ideas. Rather than consider humans capable of reshaping nature for their own benefit, the outlook switched to one obsessed with natural limits.",OBJ,0_0
"In another paper, Davi et al . (2006) developed a reconstruction of streamflow that extended from 1637 to 1997, based on absolutely dated tree-ring-width chronologies from five sampling sites in west-central Mongolia, all of which sites were in or near the Selenge River basin, the largest river in Mongolia. Of the ten wettest five-year periods, only two occurred during the 20th century (1990-1994 and 1917-1921, the second and eighth wettest of the ten extreme periods, respectively), once again indicative of a propensity for less flooding during the warmest portion of the 360-year period.",OBJ,1_7
"Those also aren't as large as the surface data would indicate, but TLT represents the average temperature in the lowest three miles or so of the atmosphere, not at ground level. Still, climate models predict that the TLT values ought to have a slightly higher warming trend than the surface temperatures, not the lower trend that the data indicates.",OBJ,0_0
You can see the moisture (precipitable water total water in inches in the atmospheric column) in this early Saturday analysis with the radar showing showers and thunderstorms.,OBJ,0_0
"What the Europeans haven't come to terms with is that their policies and the policies of the respective member governments have put their economies in a lurch. Pushing the U.S. to adopt similar regressive European policies is not going to help their industries compete with the U.S., rather it will hurt the world economy, dragging everyone down.",OBJ,0_0
"Arctic Sea Ice: Last week, TWTW linked to an article by Joe D??Aleo stating that the Arctic sea ice has stopped melting short of the observed record made in 2007. He was challenged on several blogs including claims of cherry picking data, but appears to be correct. As typical, with the fall equinox, Arctic daily average temperatures are falling and, as measured by the Centre for Ocean and Ice of the Danish Meteorological Institute, are more than 10K below freezing.",SUBJ,1_1
"And an extra bonus from the weather is not climate"" department January 29, 2010 at 39.9 degrees was ten degrees below normal and the second coldest on record.""",OBJ,1_3
"The results of this study clearly indicate, at least for this particular part of the world, that cyclone frequency and intensity do not respond to changes in temperature as predicted by climate alarmists, who say they base their claims on the output of state-of-the-art climate models. Hence, there is little reason to believe that tropical storms will respond to global warming in the ways they claim, i.e., that they will intensify and become more frequent.",SUBJ,1_7
"The Justice Department is putting together subpoenas as part of its probe into allegations of criminal misconduct by News Corp., the Wall Street Journal reported on Thursday night. The subpoenas are a sign that the phone hacking crisis surrounding the company is becoming a more serious problem in the U.S.",OBJ,0_0
This is not the first time Russian scientists predict cooling ahead. In 2006 Chabibullo Abdussamatow of the Pulkovo Observatory and a member of the Russian Academy of Sciences said global warming had already reached its peak and that reduced solar activity would start the Earth on a cooling phase. According to Ria Novosti here :,OBJ,1_2
"For example, the models predicted increasing global air temperatures (the measured rises have been much less than predicted), increasing ocean temperatures (there has been no change since 2003, when we started measuring it properly with Argo ocean-diving buoys) and the presence of a hot spot caused by humidity and cloud feedback at heights of 8km-12km in the tropical atmosphere (entirely absent).",OBJ,5_1
"Its another unusually cold winter striking the continent. Last year, hundreds froze to death. The same occurred in the winter of 2010.",OBJ,1_3
