0,subjectivity,1
"But most troubling of all, according to the UN report in 2005, is that the largest public health problem created by the accident is the damaging psychological impact to a lack of accurate information as negative self-assessments of health, belief in a shortened life expectancy, lack of initiative, and dependency on assistance from the state. end of quote",OBJ,0_0
"Moreover, the anti-hydrocarbon global warming solutions"" the Obama Administration is imposing will bring no real world benefits even assuming carbon dioxide actually drives climate change. That's largely because China, India and other developing countries are increasing their use of coal for electricity generation, and thus their CO2 emissions far beyond our ability to reduce US emissions. These nations rightly refuse to sacrifice economic growth and poverty eradication on the altar of climate alarmism.""",OBJ,4_2
"Dr. Christy is distinguished professor of atmospheric science, Alabama's state climatologist, and director of the Earth System Science Center at The University of Alabama in Huntsville. He served as lead author, contributing author, and reviewer of United Nations' IPCC assessments, have been awarded NASA's Medal for Exceptional Scientific Achievement, and in 2002 was elected a Fellow of the American Meteorological Society.",OBJ,0_0
"Enforcement of EPA's reinterpretation of NSR has discouraged modifications that, had they been allowed to proceed, would have been economically and/or environmentally beneficial and would not have increased emissions.",OBJ,0_0
"For a short background from my perspective, Dr Zorita, co-authored a paper in 2004 which pointed out the loss in variance created by methods used in Michael Manns hockey stick as demonstrated in the hockey stick posts linked above. The VonStorch and Zorita paper had a mistake in replicating Manns results in that they did the math correctly whereas Mann had it wrong so they were in the odd situation of correcting a correct paper to make it match an incorrect paper. All that aside, they demonstrate that Manns hockey stick handles are mathematically inclined to be straight.",OBJ,5_1
"The world has warmed 0.05 degrees Celsius (0.09 degrees Fahrenheit) per decade over the past 15 years, a fraction of the 0.2C (0.36F) per decade rate confidently predicted by the U.N. six years ago, according to a leaked copy of the foremost climate report in the world.",OBJ,5_1
"Climate alarmist James Hansen has long predicted the catastrophic tipping point of global temperatures from human CO2 emissions. His predictions include the seas will soon be boiling and a significant increase of extreme weather events, due to the excessive warming of the tropical atmosphere.",OBJ,5_2
"The main conclusion drawn from the body of work reviewed in this paper is that distinguishing between natural and externally forced variations is a difficult problem that is nevertheless key to any assessment of decadal predictability and decadal prediction skill. Note that all the techniques are limited by some assumption intrinsic to their analysis, such as the spatial characteristics of the anthropogenic signal, independence of noise from signal, or statistical stationarity.",OBJ,0_0
"The Administration assumes extremely rapid replacement of coal-fired power plants by new natural gas plants by 2008."" ""There is some inconsistency,"" according to CRA, ""between a very low permit price and achievement of these assumed changes.""",OBJ,0_0
"So the nonzero Feynman propagator at space-like separations isn't a consequence of some action at a distance""; instead, it is a result of a mutual contact of the two ""regions"" in the past. In the same way, the nonzero value of the quantum field isn't a prerequisite of a nonlocal behavior, either. Assume that \(x^0\lt y^0\) and the measurement of \(\Phi(x)\) makes some impact on the properties of the field around the other point, \(\Phi(y)\), which is space-like-separated.""",OBJ,0_0
"On the contrary, the opposite seems to be the case, with the highest summer temperatures in recent years well below those recorded in the first half of the 20thC, and even before.",SUBJ,1_4
"The Yen has largely gone flat, though with a slight residual drop. The general message here is that the dollar is rising, the Euro is having issues (but we already knew that) and the precious metals are not cutting it. It looks like folks are moving into the US dollar. Perhaps out of European banks?",SUBJ,0_0
Learn more:The strange silence about climate policy and the looming apocalypse,OBJ,0_0
Why did he do and say what he did? Why did those words and deeds alienate the American middle and working classes? Is there something inherent in progressive politics that is out of sync with American attitudes and aspirations?,SUBJ,0_0
"Perhaps you watched the Earth Day news coverage of the historic"" ceremonial signing of the Paris Climate Agreement during which representatives from 175 countries walked up to the stage in the General Assembly hall at the United Nations headquarters in New York, sat down behind a desk on the podium, and added their signatures to the book. ""In the name of the United States of America,"" Secretary of State John Kerry signed his name with his young granddaughter on his lap.""",SUBJ,0_0
Michael Mann proved climate change with his hockey stick,OBJ,0_0
The scientific community would come down on me in no uncertain terms if I said the world had cooled from 1998. OK it has but it is only seven years of data and it isn't statistically significant.,OBJ,0_0
A string of bankruptcies among German solar panel producers has led many to question the wisdom of Germanys renewable energy policies.,OBJ,4_2
The most telling point is that after spending $30 billion on pure science research no one is able to point to a single piece of empirical evidence that man-made carbon dioxide has a significant effect on the global climate.,OBJ,2_3
Location Length Trend Cook Is. 64 +13.7Samoa 64 -9.7Tonga 65 +29.1Tuvalu 62 -34.3Fiji 69 +10.3Kiribati 62 -21.4Marshall Is. 58 -11.7Vanuatu 55 +12.1Nauru 59 -26.4Solomon Is. 45 -41.3Papua NG 32 -43.6,OBJ,0_0
"The Arctic ocean is warming up, icebergs are growing scarcer ( ) Reports all point to a radical change in climate conditions. ( ) Great masses of ice have been replaced by moraines of earth and stones, while at many points well-known glaciers have entirely disappeared.",OBJ,0_0
"The entire world was being asked to change the way it lives on the basis of pure hyperbole. Propriety, probity and transparency were routinely sacrificed.",OBJ,0_0
"The current drought in the US is quite ordinary, and the US has seen many similar or worsedroughtsover the last century.",OBJ,0_0
"2) Winter To Be Mild Predicts Met Office Daily Express, 28 October 2010",OBJ,0_0
House Science Committee Chairman Smith has expressed a commitment to look into concerns that the real purpose of NOAA's report was to push President Obama's political agenda.,OBJ,0_0
"The think-tank, which champions sound climate science,"" is known for its skeptical view of the catastrophic climate change narrative, raising fears that the attorneys general will target not just fraud but scientific disagreement on climate issues.""",OBJ,0_0
"In the concluding paragraph of their paper, Li et al . write that the dwarf bamboo plants could adjust their physiology and morphology to enable the capture of more light, to increase water use efficiency and improve nutritional conditions."" However, they also indicate that elevated temperature had just the opposite effects on water use efficiency and nutritional traits of leaves. But in the end , they report that ""the combination of elevated CO 2 and elevated temperature showed no significant interaction effect on the nutritional traits of leaves."" And, therefore, their ultimate conclusion was that if and when ""the dwarf bamboo confronts warmer climate for a long term, elevated CO 2 will be beneficial,"" as it will lead to the production of more equally-nutritious dwarf bamboo tissue.""",OBJ,3_3
"High energy prices disproportionately hurt the poor: Policies that make energy more expensive have regressive effects. According to the government's 2012 Consumer Expenditure Survey, those in the lowest earnings quintile spent 28% of their incomes on energy electricity, natural gas, gasoline, and motor oil. This is far more than the U.S. average of 9%, and the 4% spent by the top quintile. Increases in energy costs affect the prices of other consumer goods as well.",OBJ,0_0
"Due to the intermittent nature of wind power, traditional power plants have to adjust production in an extremely short time frame to balance the power grid. This cycling"" is inefficient and bad for the environment. Emissions offset by the installation of wind turbines appear to be surpassed by emissions from the need to cycle.""",OBJ,4_4
"Following massive aboveground destruction caused by both fires and hurricanes , atmospheric CO 2 enrichment is able to bring scrub-oak ecosystems back from the brink of death , so to speak, to once again flourish, as the life-giving gas stimulates root production and the acquisition of needed-but-scarce soil nutrients?? Read",SUBJ,3_3
"On Error Resume Next Shock Mode = (IsObject (CreateObject (ShockwaveFlash.ShockwaveFlash.10""))) // ->""",OBJ,0_0
"In January, de Blasio appointed John Adler director of the Mayor's Office of Pensions and Investments and chief pension investment advisor. Adler spent 23 years with SEIU, as an 1199 organizer and later as a retirement- and pension-policy official. His appointment likely stemmed from his 1199 connectionsit couldn't have owed to his financial wizardry: the union's pension fund recently showed up on the federal government's watch list of endangered multiemployer funds.",OBJ,0_0
"The only observed warming over the period is from 1978 to 1998, 20 years only, out of the 55 years.",OBJ,1_4
"on Tuesday, July 27th, 2010 at 7:52 pm and is filed under Uncategorized.",OBJ,0_0
Tree-Based Climate Reconstructions in CO2-Accreting Air,OBJ,0_0
"Green taxes could force one in four into fuel poverty One in four households will be driven into fuel poverty if the Government pursues controversial green energy targets, ministers have been warned.Radical policy change may be necessary to protect millions of struggling families from biggest household price shock since the 1970s, according to City analysts. (Daily Mail)",OBJ,4_1
Sea levels continue to rise a minuscule amount each year as they have since the last ice age when sea level was perhaps 400 feet lower than it is today. I just cant see New York under water anytime in the 21st century at the present observed rates which dont seem to be changing.,SUBJ,1_6
"If, for example, you are Laurence Tribe in 1984, Harvard professor of law, leftist pillar of the establishment, you can write"" your magnum opus by using the products of your student assistant, Ron Klain.""",OBJ,0_0
"I am sure that history will file your names alongside such credentialed luminaries as Hwang Woo-suk, Luk Van Parijs, Jon Sudbo, and William Summerlin.",OBJ,0_0
"Judith Curry wrote a revealing summary of reflections on the fifth anniversary of Climategate. It references an early Curry commentary on Steve Mcintyres site titled, On the credibility of climate research. In that article Curry provides examples of Ivory Tower thinking.",OBJ,5_2
"The sharp rise in UK temperatures, which effectively began in the 1980s, is widely known about, but, (and I may be wrong here), has never been satisfactorily explained. Indeed, I am not sure anybody from the Met Office, Hadley Centre, etc has ever seriously attempted to explain it.",OBJ,5_1
"As illustrated and discussed, while global surface temperatures rose slightly in 2014, the minor uptick did little to overcome the growing difference between observed global surface temperature and the projections of global surface warming by the climate models used by the IPCC.",OBJ,5_1
"New research results suggest that magma sitting 4-5 kilometers beneath the surface of Oregons Mount Hood has been stored in near-solid conditions for thousands of years. The time it takes to liquefy and potentially erupt, however, is surprisingly shortperhaps as little as a couple of months.",SUBJ,0_0
"What a different nation America could be were it not for Obama's deliberate attack on the coal industry in particular and other fossil fuels, oil and natural gas. In the name of reducing emissions, Obama deliberately ignores the increasing use of coal in Europe and nations that include China, Japan, and India.",OBJ,4_2
"Based in Nairobi, UNEP was set up in 1972 as an office of the UN, but as a programme"" it does not have the scope of an agency.""",OBJ,0_0
How to Destroy Science: Cast Self-Interest as Public Interest,OBJ,0_0
The data manipulation that has been most seized upon by bloggers involves the choice of which sources of temperature data should be used to reflect climate trends after 1960.,SUBJ,5_2
"In the new CEI Podcast, Warren Brookes Fellow Kathryn Ciano interviews Carrie Lukas from the Independent Women's Forum about the male-female pay gap.",OBJ,0_0
"Since the Guardian was not the only European paper to feature this storyGermany's Der Spiegel cautioned A Tropical Germany by 2100?""perhaps it's not surprising that the U.N. report inspired politicians of various hues, across Europe and the world, to seek controls on carbon emissions and the fossil fuels that create them. The British environment minister called for an ""international political commitment to take action."" The head of the German environment agency said, ""We must all change our environmental behavior considerably."" So much was said about the need for ""action"" and ""change,"" in fact, that it's a wonder the resultant hot air didn't make temperatures rise higher.""",SUBJ,0_0
"In the past, we have often referred to cosmic rays as galactic cosmic rays or GCRs, because we did not know where they originated. Now scientists have determined that the sun discharges a significant amount of these high-energy particles. Solar Cosmic Rays (SCRs cosmic rays from the sun) originate in the suns chromosphere . Most solar cosmic ray events correlate relatively well with solar flares. However, they tend to be at much lower energies than their galactic cousins.",OBJ,0_0
"Thank you, Lord Monckton, our champion of Climate-gate! Merry Christmas, sir!",OBJ,0_0
"The recognized antithesis of hotheads are the flatliners, who contend that there is no measurable warming caused by increasing atmospheric carbon dioxide. Their bible is the lack of warming in the last 16-odd years, when CO2 levels have risen the most. They do have a problem explaining the rise in temperatures in the preceding decades.",OBJ,1_4
Temperatures are above 0F (-18C) in the middle of the Urban Heat Island.,OBJ,0_0
Democratic Institutionstransparent and accountable governing institutions that promote economic growth,OBJ,0_0
"But the media was not on board. Most journalists are ignorant of climate and weather science. I was fortunate in that I was not, so my editors passed on to me the great amount of work and I was busy enough as it was a police reporter as it was! Since my beat included covering the climate science community in the heart of it in Colorado, I was well-attuned to how events were shaping up by 1989.",OBJ,0_0
"A conservative Republican, in cohoots with Gore and Pelosi, arguing that we need to take action to address climate change imagine that! Key players in the Climate Denial Machine, such as web spinner Marc Morano, are holding Gingrich's feet to the fire: Newt Gingrich is arrogant enough to believe that he doesn't have to play by the same rules as everyone else,"" Morano told Fox News, and went on to predict that the ad was going to hurt Gingrich with the Republican base.""",SUBJ,0_0
"We are being told atmospheric carbon dioxide levels leapt, so why didnt it get unbearably hot?",SUBJ,2_3
"Fred Dardick, When will science get serious about global cooling?",SUBJ,0_0
"Right now, many European countries prohibit fracking, and EU climate and renewable energy policies have sent business and family energy prices into the stratosphere, killing jobs and preventing families from heating their homes properly.",OBJ,4_1
"The EUs plan to regulate the output of carbon dioxide, as part of the effort to combat global warming, has stirred concern in the European aviation industry. Airbus which employs more than 50,000 people across Europe argues the proposals will damage competitiveness at a time of economic weakness, wants the EU to put on hold the extension of the scheme to airlines until a global plan for regulating carbon emissions by airlines can be agreed.",OBJ,4_1
"With touching candour, the UN, in the latest IPCC climate report AR5, published this graph of world temperature observations (AR5 WG1 Chp 2 p.193). It reassures us that theres been insignificant global warming in about the last 20 years, while atmospheric CO2 concentrations became the highest in human history. Of course, since the temperature has not risen, it did not cause any extreme weather in the last 20 years. It has all been entirely natural.",OBJ,1_4
"By Andrew Montford, Bishop Hill, Aug 10, 2015",OBJ,0_0
Mitch McConnell Wins Praise In Unlikely Corners Back Home,OBJ,0_0
"Finally, the Yale/George Mason University polls failed to ask the two most important questions in the whole debate:",OBJ,0_0
"Experience mods take into account your premiums paid and your losses as compared to other companies in the same job class code. A modifier of 1.2 means you are 20% worse than average in claims history than others in your job code. Note that all history is not the same - I do not know the exact formula, but I do know that 10 claims for $5000 each will be treated as worse than 1 claim for $50,000, even though the total amounts are the same. Given this, it would really help if workers comp insurance policies could have a deductible, but many states do not allow this ( I posted on this problem here ). NCCI has a description of this whole rating process here .",OBJ,0_0
"Noting that the elevated CO 2 treatment mitigated PSII-photoinhibition through enhanced electron transport rates and through efficient biochemical reactions in leaves of G. arborea ,"" Rasineni et al . conclude that their data ""demonstrate that future increases in atmospheric CO 2 may have positive effects on photochemical efficiency in fast growing tropical tree species,"" allowing them to take great advantage of the high-light midday period of potential maximum growth in earth's tropical regions.""",OBJ,3_3
1988 Hansen Model vs. 2009 UAH Lower Troposphere (13-month mvg. avg.),OBJ,0_0
"Many people rely on our profile on Wikipedia to provide an objective description of our mission, programs, and accomplishments. Alas, the profile they find there is a fake, filled with lies and libel about our funding, tactics, and the positions we take on controversial issues. Wikipedia refuses to make the changes we request. It even deletes and reverses all the changes made by others who know the profile is unreliable. We need your help! READ MORE",OBJ,0_0
Environmental Protection Agency administrator from 2001 to 2003; governor of New Jersey from 1994 to 2001; chair of the Republican Leadership Council,OBJ,0_0
"It means that there should be no disjunction, no blemish in concept or communication and nothing obscured when it comes to public decisions and action.",SUBJ,0_0
"What's interesting is that there are those arguing that the fight should be called off before a punch is even thrown. The winner will have to take on The Status Quo, and cap-and-traders want to go into that fight unblemished. Since they're the only ones with a chance, the argument goes, the Pigou Clubbers should toss in the towel now.",SUBJ,0_0
"It is this graph of the widening gap between the predicted and observed trends that will continue to demonstrate the absence of skill in the models that, until recently, the IPCC had relied upon.",OBJ,5_1
CEI Expert Available to Comment: Technology Analyst Peter Suderman on regulation of social networking websites:,OBJ,0_0
"The programme, like climate science itself, attracted controversy before it even came on air. James Delingpole, a vocal climate change sceptic who appears in the documentary, yesterday called the programme another hatchet job on his Telegraph blog.",OBJ,5_2
"They should reject hyper-individualistic libertarianism,"" ""mean-spirited words"" and (in an uncharacteristically nasty analogy) ""the tea party's Wahabbi-style drive to restore pure, uncompromised conservatism.""",SUBJ,0_0
"When future generations try to understand how the world got carried away around the end of the 20th century by the panic over global warming, few things will amaze them more than the part played in stoking up the scare by the fiddling of official temperature data. There was already much evidence of this seven years ago, when I was writing my history of the scare, The Real Global Warming Disaster. But now another damning example has been uncovered by Steven Goddards US blog Real Science, showing how shamelessly manipulated has been one of the worlds most influential climate records, the graph of US surface temperature records published by the National Oceanic and Atmospheric Administration (NOAA).",OBJ,5_2
"But the wins were illusory in at least two respects. First, the GOP's hold on Congress was tenuous at best. Democrats regained control of both the House and the Senate in the 2006 midterm electionsand did so without losing as single seat, a first since 1938.",OBJ,0_0
"When I started that job in 1999 the evidence that carbon emissions caused global warming seemed pretty good: CO2 is a greenhouse gas, the old ice core data, no other suspects.",OBJ,0_0
Governancean honest and effective government that preserves order and encourages productive citizenship,OBJ,0_0
"There did not seem to be any other signs of a pre-revolutionary crisis either, including the other traditionally assigned cause of state failure external pressure. On the contrary, the previous decade was correctly judged to amount to the realization of all major Soviet military and diplomatic desiderata,"" as American historian and diplomat Stephen Sestanovich has written. Of course, Afghanistan increasingly looked like a long war, but for a 5-million-strong Soviet military force the losses there were negligible. Indeed, though the enormous financial burden of maintaining an empire was to become a major issue in the post-1987 debates, the cost of the Afghan war itself was hardly crushing: Estimated at $4 billion to $5 billion in 1985, it was an insignificant portion of the Soviet GDP.""",OBJ,0_0
"2. During the 20th century, a global warming of between 0.4C and 0.7C occurred, at a maximum rate, in the early decades of the century, of about 1.7C/century. In comparison, our best regional climate records show that over the last 10,000 years natural climate cycling has resulted in temperature highs up to at least 1C warmer than today, at rates of warming up to 2.5C/century.",OBJ,2_1
"The dissertation paper, written by professional mountain guide and climate change campaigner Dario-Andri Schworer while he was studying for a geography degree, quotes observations from interviews with around 80 mountain guides in the Bernina region of the Swiss Alps.",OBJ,0_0
"Actually, it might. It would depend what we did with the revenue. Imagine we used it to finance a cut in payroll taxes. That would make it more expensive to pollute, but cheaper to hire people. That could be a nice combo. I wouldn't bet much on the political chances of the carbon tax, but it's got enough promise to at least go down swinging.",OBJ,0_0
"communications with other academic colleagues, I think that we would weaken",SUBJ,0_0
"That, and there??s no tropospheric hot spot (which would also expand the atmosphere) as expected from warming, from:",SUBJ,2_3
"That's amusing enough, of course, but even better is the description of what actually went on while the inconvenient snow was falling:",OBJ,0_0
"In their simulations, Exponent observed that the difference in measurements between extremes of dry and wet balls was relatively small as follows:",OBJ,0_0
"Given that the climate debate is about minuscule fractions of a degree, that measurement uncertainty is too large for comfort. It is one reason why we are able to say that over the past couple of decades the measured global warming is statistically indistinguishable from zero.",OBJ,1_4
HAVE you ever wondered what happens when corals grow so tall they are above sea level or whether the Great Barrier Reef could extend its range further south with global warming?,SUBJ,3_2
Showbiz Sandbox 112: Why Netflix Had To Raise Its Prices:,OBJ,0_0
"The overwhelming success of the Mega Millions enterprise makes it an irresistible target for something more a way to transform American elections and along the way reduce our deep political dysfunction. Our take-no-prisoners tribal politics have at root the reality that the two parties' narrow ideological bases have far more influence on the selection of candidates, the positions taken by the candidates and the pressures placed on elected officials than the rest of the population. With turnout in presidential elections hovering between 50 and 60 percent, 30 to 40 percent for mid-term congressional contests, and sometimes 10 to 20 percent for primaries, it is the bases who rule.",OBJ,0_0
"Watts, A. (2009). Is The U.S. Surface Temperature Record Reliable? Downloaded from http://wattsupwiththat.files.wordpress.com/2009/05/surfacestationsreport spring09.pdf .",SUBJ,0_0
