0,subjectivity,1
"This common fingerprint is often misrepresented and misunderstood. In addition to the contradiction presented by the observed lack of warming of the troposphere compared to the surface warming over the last 20 years (see question 4), there are important unresolved questions. For example, computer models predict a cooling of the stratosphere from increased CO2, but this expected cooling is difficult to see among other, more dominant effects from volcanic aerosols to changes in stratospheric ozone and solar ultraviolet radiation.",OBJ,0_0
"Despite this, people like Mann continue their climatological malpractice, and are even accorded respect. Such shoddy workmanship in any other field would put the principal into another line of work.",OBJ,5_2
"Climate Models: 100% right except for rain, drought, storms, humidity and everything else",OBJ,0_0
"So, in their capacity as authors of Otto et al. (2013), we have fourteen lead or coordinating lead authors of the WG1 chapters relevant to climate sensitivity stating that the most reliable data and methodology give likely and 595% ranges for TCR of 1.11.7C and 0.92.0C, respectively. They go on to suggest that some CMIP5 models have TCRs that are too high to be consistent with recent observations. On the other hand, we have Chapter 12, Box 12.2, stating that the ranges of TCR estimated from the observed warming and from AOGCMs agree well. Were the Chapter 10 and 12 authors misled by the flawed TCR estimates included in Figure 10.20a? Or, given the key role of the CMIP5 models in AR5, did the IPCC process offer the authors little choice but to endorse the CMIP5 models range of TCR values?",SUBJ,0_0
Dr. Madhav L. Khandekar : The earth's climate has NOT warmed in 16 years per UK Met Office! We may not see warming of the climate by more than 0.5C in next 50 to 100 years.,SUBJ,1_4
Antarctic Sea Ice (1979-2002),OBJ,0_0
"In addition, the platform supports the Paris Agreement, an international agreement adopted by 195 countries that aims to keep global temperature increases to well below"" two degrees Celsius.""",OBJ,0_0
ANE says that success can breed jealousy and koda is probably breeding a lot of it these days.,OBJ,0_0
Climategate 3.0: MetOffice rebukes UEA for claiming global warming causes extreme weather,OBJ,0_0
"?? taking a line from our IPCC brethren?? While any single month??s drop in global temperatures cannot be blamed on climate change, it is still the kind of behavior we expect to see more often in a cooling world.",SUBJ,1_2
"He has graciously agreed to write a guest weblog for Climate Science, as well as also post on his own website ( madweather ). Dr. Maddoxs weblog is important since it provides another example of the lack of consideration by NOAA on the need for proper siting of instrumentation that is required to monitor weather and climate.",OBJ,5_1
"The models perform best in the extratropical oceans of the Northern Hemisphere, in the North Atlantic and in the Arctic Ocean. The modelers focus is pretty obvious. Theyve tried to get the models to simulate the warming of the Arctic Ocean so that they could melt sea ice, and theyve tried to better capture the warming of sea surface temperatures at latitudes with the most land (extratropical Northern Hemisphere. See the graph here .) so that they could better simulate the Northern Hemisphere land surface air temperature anomalies, which would also be necessary if they wanted to melt Arctic sea ice. Figures 23 and 24 confirm a part of that.",OBJ,0_0
"Your SUV has overheated the planet, and caused one of the coldest years on record in the US.",SUBJ,1_3
"The point here is that Die Zeit is just too fanatic and caught up in AGW dogmatism, and thus cannot be taken seriously as an objective source of any kind.",OBJ,0_0
"This PR from McGill University claims that the ???deep ocean heat has been unable to get out and melt back the wintertime Antarctic ice??. That might be true, but still, there are polynyas present in the location of interest (Weddell Sea) that they don??t mention. In fact, there??s even a large offshore polynya in progress in the Weddell Sea right now according to NSIDC imagery, and the Weddell sea has a lot more ice where it is not supposed to be according to ???normals??. See below ??? Anthony",OBJ,1_1
"From President Obama, in campaign rather than governing mode these days, we hear denunciations of Republicans for killing proposals for legalizing illegal immigrants.",SUBJ,0_0
"I selected 18591882 and 19952011 as they seem to me to be the best periods for estimating TCR. But it is worth looking at longer periods as well, even though the signal-to-noise ratio is lower. Using 18501900 and 19852011, two periods with mean volcanic forcing levels that, although significant, are well matched, gives a TCR best estimate of 1.24C, or 1.30C based on the unadjusted AR5 aerosol forcing estimate. The TCR estimates are even lower using 18501900 to 19722011, periods that are also well-matched volcanically.",SUBJ,0_0
"Global Warming Alarmist Rhetoric, Propaganda and Dishonesty Heats Up in Paris",OBJ,5_2
Heartlander: September-October 2010 (full-text PDF),OBJ,0_0
"Suppose the outcome of applying a sophisticated probability algorithm gave us the estimate of 0.72 for equation #3. Does writing this number more precisely help if you suppose you are the doctor who has to prescribe either D or P? Assume that no cheating took place in the old trial, then drug D is better if the patient in front of you is like the patients from the old trial. What is the probability she is so (given the information from the old trial)?",OBJ,0_0
"Proponents of Internet sales taxes are asking the lame-duck Congress to bless their state tax cartel as part of a larger tax reform package by passing the Marketplace Equity Act (H.R. 3179) and its companion in the Senate, the Marketplace Fairness Act (S. 1832). These aren't your average tax increases, but grim blueprints for government's future relationship with the online world. Long after we've either swerved at the last minute or gone off the fiscal cliff"" a la ""Thelma and Louise,"" we'll have to live with the harmful consequences of expanding government to every corner of the Internet. >""",SUBJ,0_0
"Global warming activists, while mustering genuine outrage for media interviews, must have been delighted. If they had written the EPA report themselves, they could hardly have done a better job of convincing the public that the scientific consensus on global warming is overwhelming. Scientists, we were to believe, had proved that man-made climate change is destroying the earthonly to be silenced by the Galileopersecuting Bush administration.",SUBJ,0_0
"Before long, Oslo had receded from memory, becoming part of the history that oppresses rather than liberates the Middle East.",OBJ,0_0
get ? and has to be well hidden. I?ve discussed this with the main funder (US,OBJ,0_0
"AGs' motives questioned as Exxon climate change fraud' probe recalls tobacco windfall""",OBJ,0_0
"A high-quality, motivated workforce with diverse ideas, skills, and backgrounds",OBJ,0_0
"A new report by the Greening Earth Society (GES) reveals the difficulties of interpreting temperature data. Robert C. Balling, Jr., Director of the Laboratory of Climatology at Arizona State University, analyzed the temperature data from Japan that he obtained from the Intergovernmental Panel on Climate Change. The data, which begins in 1878, shows a curious pattern. From 1878 to 1947, the IPCC data shows a slight and statistically insignificant cooling of 0.18 degrees C. It also shows a statistically insignificant cooling of 0.09 degrees C from 1948 to 1998. Yet over the entire 121 year record, Japan warmed by 1.02 degrees C.",OBJ,0_0
"A paper published by the Danish Meteorological Institute finds a remarkable correlation of Arctic sea ice observations over the past 500 years to ???the solar cycle length, which is a measure of solar activity.A close correlation (R=0.67) ofhigh significance (0.5 % probability of a chance occurrence) is found between the two patterns,suggesting a link from solar activity to the Arctic Ocean climate.?? The paper adds to several others demonstrating that Arctic sea ice extent and climate is controlled by natural variations in solar activity, ocean & atmospheric oscillations, winds & storm activity , not man-made CO2.",OBJ,2_1
The revised and expanded paper is available here as an Adobe Acrobat PDF.,OBJ,0_0
Other examples of this step change in a metric occurring at a data redefinition or change in measurement technique can be found in,OBJ,0_0
"This is no mere rhetoric on the part of Obama and Kerry: they believe what they are saying, and that other policy goals should be subordinated to their goal of a carbonless future. For them, natural gas is at best a bridge fuel"" to take us to the day when the world relies completely on solar, wind and other non-fossil fuels to operate highly energy-efficient cars, factories and homes. From which it follows that encouraging exports of natural gas is undesirable, putting in place infrastructures here and in importing countries more reliant on climate-changing fossil fuels, and reducing Europe's incentive to continue down the expensive path to a fossil-fuel-free future. Key Democrats up for re-election in November don't have as green a view of the future: they see fracking and natural gas exports as job creators and, now, an essential piece of any strategy to contain Putin.""",SUBJ,0_0
to abandon bias and extreme statements and to embrace debate,OBJ,0_0
"Clearly geologically induced heat flow is a tenable alternative explanation to recent glacial acceleration on the Svalbard Islands. Disappointingly, this possibility is never mentioned in worldwide press releases, but the much more speculative notion of man-made global warming is mentioned in nearly all media coverage.",OBJ,0_0
Defenders are making ludicrous and contradictory claims to explain what is happening. They said they were 90+ percent certain warming since 1950 was due to human CO2 with natural causes of little or no consequence. Now theyre saying the lack of warming of the last 17 years is because of natural variability and decreasing solar activity.,OBJ,5_2
"In this context, equation 12.1 provides a good representation for Venus, with little diurnal variation and pole-to-equator temperature gradient (Jupiter and Saturn have large internal heat sources, so equation 12.1is not applicable). For Venus, a time integration or spatially varying energy balance model would add nothing.",OBJ,0_0
I find it hard to equate the vast new supplies coming on line from shale gas deposits with the prices hikes we are seeing.,SUBJ,0_0
Fig. 2. Re-analysis of the satellite-based feedback parameter estimates of Forster and Gregory (2006) showing that they are consistent with negative feedback rather than positive feedback (low climate sensitivity rather than high climate sensitivity).,OBJ,3_1
"And of course, if the scientist was unable to disprove no warming in 23 years?? well then it??s probable that warming probably either a) wasn??t happening or b) it was slower than 1.1 C/century.",OBJ,1_4
"This brand of free and honest debate"" seems to be one in which the Mountain State comes out as a big beneficiary. You can't deny that.""",SUBJ,0_0
"Well, I wasn??t going to mention this paper, but it seems to be getting some play in the blogosphere. Our friend Nicola Scafetta is back again, this time with a paper called ???Solar and planetary oscillation control on climate change: hind-cast, forecast and a comparison with the CMIP5 GCMs?? . He??s posted it up over at Tallbloke??s Talkshop. Since I??m banned over at Tallbloke??s, I thought I??d discuss it here. The paper itself is here , take your Dramamine before jumping on board. Dr. Scafetta has posted here on WUWT several times before, each time with his latest, greatest, new improved model. Here??s how well Scafetta??s even more latester, greatester new model hindcasts, as well as what it predicts, compared with HadCRUT4:",SUBJ,2_1
"The resulting energyused all across the economybecomes less expensive. Cheaper energy lowers the cost of doing business, making American companies more competitive and enabling them to invest and expand.",OBJ,0_0
"As one would expect, Europe does very well in the rankings and has the highest representation at the top of the list with fourteen of the top twenty countries. The highly homogenized populations of Finland, Switzerland, Sweden, Denmark, and Norway are listed in order as the top five most prosperous countries. The larger and more ethnically diverse populations of the United Kingdom (twelfth), Germany (fourteenth), France (seventeenth), Spain (nineteenth), and Italy (twenty-first) also rank highly.",OBJ,0_0
"Sea level was stable from at least BC 100 until AD 950. Sea level then increased for 400 y at a rate of 0.6 mm/y, followed by a further period of stable, or slightly falling, sea level that persisted until the late 19th century. Since then, sea level has risen at an average rate of 2.1 mm/y, representing the steepest century-scale increase of the past two millennia. This rate was initiated between AD 1865 and 1892.",OBJ,1_6
"To put it another way: in July of last year, at least 7/8th (87%) of the warming was due to natural processes, and the truth surely was well over 90%. It is funny that Dr. Hansen and others exaggerating the effects of human emissions don't say it this way. The correct way.",OBJ,2_1
New research questions the forecasting methods scientists have been using to predict future global warming,OBJ,5_1
"Contrary to David Evans hypothesis I think that the cause of a decadal lag between solar change and climate response is to be found in the oceans, not the Sun. Seawater has a high heat capacity, and its deep. This mass of global ocean damps the climate response to solar input. It also stores and releases energy on long timescales. This is why the latest explanations for the pause in global warming hypothesises that the ocean is eating excess energy. This is correct in my opinion, except its not excess energy from an alleged enhanced greenhouse effect that its eating, its solar energy, which penetrates the ocean to a depth of 100m, whereas longwave radiation from the atmosphere cant penetrate the ocean surface.",SUBJ,2_1
"The idea is to beef up the UN Environment Programme (UNEP), which critics say lacks muscle for dealing with the world's worsening environmental crisis.",OBJ,0_0
"Agreement signed at Stockholm and Washington November 23 and December 6, 2005; entered into force December 6, 2005.",OBJ,0_0
"This month, after a three-year investigation, Harvard University suspended a prominent professor of psychology for scandalously overinterpreting videos of monkey behaviour. The incident has sent shock waves through science because it suggests that a body of data is unreliable. The professor, Marc Hauser, is now a pariah in his own field and his papers have been withdrawn. But the implications for society are not great no policy had been based on his research.",OBJ,0_0
"Moreover, DSM policies have created razor-thin supply margins, resulting in price volatility and rolling blackouts during periods of peak demand. During the summer of 2007, California utilities actually told people to turn off their air conditioners on hot days. That is not efficient. It is a good way to get heat stroke.",OBJ,0_0
"For Delaware Democrat Chris Coons, it's fitting that Election Day comes two days after Halloween, running as he is against that sometime dabbler in witchcraft, Christine O'Donnell. For hundreds of his partisan brothers and sisters, however, another holiday reference is more appropriate: Mexico's Day of the Dead. Today, our neighbors to the south will begin celebrating the memories of their deceased family and friends. Tomorrow, our neighbors to the left will mourn the demise of hundreds of candidates whose careers will be consigned to the political graveyard, few of which will rise to take bodily form again.",SUBJ,0_0
"In short, exactly the opposite of what leftist activists intended let alone claim to have achieved has actually occurred. If you think 2012 marks the demise of The Heartland Institute, I suggest you check back with us in five, 10 or 20 years. Well still be here, fighting for smaller government, individual liberty and free markets just as we have for the last 28 years.",SUBJ,0_0
"At the 0:50 mark Schellnhuber is shown in an exclusive interview on ZDF German public television on October 30, 2009, explaining the risks of the globes third ice cap : the Tibetan Plateau, whose summertime melt water feeds a number major Asian rivers that help support 2.5 billion people in the region. Schellnhuber at the 2:06 mark:",OBJ,0_0
I dont intend to be telling Australia what they should do for their energy source except that they cant continue to burn coal without screwing everybody including my grandchildren.,SUBJ,0_0
"Principal Research Scientist, Ice Cores and Climate, Australian Antarctic Division, Hobart may well be right is linking the events we will look for a peer reviewed paper on the subject.",SUBJ,0_0
"Counsel for Special Projects Hans Bader joins this chorus. Under this bill, a blogger like Emile Zola, the courageous writer who exposed an anti-semitic witchhunt a century ago in the infamous Dreyfus Affair through his repeated and ""vehement public' denunciations of public officials, would be subject to prosecution,"" argues Bader. ""His ""severe, repeated, and hostile' denunciations resulted in many public figures being discredited and removed from office, which no doubt caused them ""substantial emotional distress.'""",SUBJ,0_0
Margot Wallstrom of Sweden has been promoted in the new European Union Commission to head the commission's communications efforts. She has been replaced as Environment Commissioner by Stavros Dimas of Greece.,OBJ,0_0
"This would be decisive if today??s models accurately simulate all important modes of natural variability. In fact, models do not accurately simulate the behavior of clouds and ocean cycles. They may also ignore important interactions between the Sun, cosmic rays, and cloud formation.",OBJ,5_1
"Recall that she mentioned polar ice, sea levels, storms, and ocean acidification. With respect to polar ice, the National Snow and Ice Data Center reports that the Arctic and Antarctic sea ice extents now do not differ from their respective 19812010 averages as a matter of statistical significance. (The 20152016 Arctic data are near the bottom of the statistical confidence interval, while the 20152016 Antarctic data are near the 19812010 average.)",OBJ,1_1
Mr. D??Aleo and Mr. Watts provide some amazing graphs showing that the jumps in measured global temperature occurred just when the number of weather stations was cut. But there is another bias that this change to more urban stations also exacerbates. Recorded temperatures in more urban areas rise over time simply because more densely populated areas produce more heat. Combining the greater share of weather stations in more urban areas over time with this urban heat effect also tends to increase the rate that recorded temperatures tend to rise over time.,SUBJ,5_1
"The models all reckon the feedbacks amplify the warming, but three independent sources of empirical evidence suggests the opposite occurs, and that the feedbacks are negative (ie. they dampen). In that case the headline threat reads Half a Degree .",OBJ,3_1
"Ah, but you won't have to wait nearly as long for the higher cost of energy to be passed on to all Americans. And not just in the form of higher utility bills (which are already bad enough), but in the cost of nearly everything. After all, the businesses that you use will be facing higher bills, too. That increase will be paid by you as well.",OBJ,4_1
"The Honourable John Howard, former Prime Minister of Australia, gave the Annual GWPF Lecture in London on Nov 5. The title of his lecture was One Religion is Enough, and full text is available from the GWPF . Excerpts:",OBJ,0_0
"With a new contract for society, the Council desires to implement the Great Ecological Transformation to a nuclear-free and carbon-free global economy. A powerful, ruling government shall provide for this, and will care for the societal problemtic of non-sustainable living styles. Climate protection will be one of the fundamental targets of the state. Our current parliamentary democratic legal process is to be supplemented by a Future Council which will be expressly superordinate over Parliament, party squabbling and conflicting interests, and will be assembled by draw.",SUBJ,0_0
"Bethesda, MDIf you are obese and hope to be a father, heres another reason to lose weight: your children and grandchildren may inherit your waistline or metabolic disorders. Thats because scientists have discovered in mice that obese fathers, even those who did not show any signs of diabetes, passed this negative trait on most frequently to their daughters. Sons dont entirely dodge this genetic bullet eitherboth sons and daughters of obese fathers have increased risks of developing metabolic diseases, such as diabetes.",SUBJ,0_0
"And researchers at the National Climatic Data Center in Asheville, N.C., reported this week that nighttime summer temperatures across the country have been unusually high for the past eight years, a record streak. Its just incredible, when you look at this thing, said Richard Heim, a research meteorologist at the center. He added that only the Dust Bowl period of the mid-1930s rivaled recent summers for sustained heat levels.",OBJ,0_0
08-03 08-04 FQtr 08-05 08-06 08-07 08-08 08-09,OBJ,0_0
A study of sea sediment cores in the Chukchi Sea shelf in the Arctic Ocean concluded that `during the middle Holocene the August sea surface temperature fluctuated by 5C and was 3-7C warmer than it is today.,SUBJ,2_1
The reaction rate in the opposite direction is given pss of,OBJ,0_0
Harumph. So weve got a downtrend. We take a flat step up on dropping to a single thermometer. Then a final rise in the end. But whats in that rise? A large quantity of missing data:,SUBJ,5_1
Economy In Jeopardy As Budget Deal Affirms EPA Climate Programs,SUBJ,0_0
"As a token gesture towards those of us who dislike State-funded propaganda that is also wasteful and prodigiously carbon-emitting, in one of Copenhagen?s squares a giant Christmas tree covered in white lights (colored Christmas decorations are regarded as vulgar in Denmark) is surrounded by a couple of dozen fixed bicycles attached to generators, so that the eco-Fascists can feel good about the environment as they pedal like mad to keep the Christmas-tree lights on.",SUBJ,0_0
"fact that the Atmosphere Ocean General Circulation Models are not able to explain the post-1970 temperature increase by natural forcing was interpreted as proof that it was caused by humans. It is more logical to admit that the models are not yet good enough to capture natural climate variability (how much or how little do we understand aerosol and clouds, and ocean circulation?), even though we can all agree that part of the observed post-1970 warming is due to the increase of atmospheric CO2",SUBJ,5_1
"So the planet has got a little warmer in the last 200 years, and grapes are ripening a little earlier. Just as it got colder before the Little Ice Age and, no doubt, grapes ripened a little later. Its called climate and its what the planet does.",OBJ,2_1
"As for the EU's additional measures, these are proving difficult to adopt. Instead, the British government is on the verge of approving a new runway at Heathrow Airport and is considering applications to build a number of new coal-fired power plants. The German government has applied for special exemptions for its coal industry and on behalf of its auto industry is resisting the European Commission's new proposal to regulate auto emissions.",OBJ,0_0
"Chernobyl was a tragic event, but nothing remotely close to the global catastrophe I imagined. About 50 people had died in Chernobyl, roughly the number of Americans that die every day in traffic accidents. I dont mean to be gruesome, but it was a setback for me. You cant write a novel about a global disaster in which only 50 people die.",SUBJ,0_0
"> >> >At 21:55 22/03/99 -0500, you wrote:",OBJ,0_0
"Anyway, centuries ago actors and non-baptized children were not deemed worthy of Christian burials, and attitudes have (slowly) evolved beyond that.",OBJ,0_0
"In reality, the United States has vast storehouses of petroleum. Hydraulic fracturing alone has unlocked billions of barrels of oil equivalent energy, created 1.7 million jobs, generated hundreds of billions of dollars in economic activity and government revenues, and made America the world's number one energy producing nation. Opening up areas that are now closed to leasing would build on this record.",OBJ,0_0
This report of growing a food crop among solar cells just makes me breathless. What a special thing.,OBJ,0_0
"The National Interagency Fire Center reports 85,000 wildfires occurred in 1986, versus only 47,000 wildfires last year. Fewer wildfires occurred in 2013 than any year since 1984, and 2013 had the third-fewest wildfires since records began in 1960.",OBJ,1_7
"Renewable energy hucksters ignore all of this, as they seek more grants, tax credits, production mandates, feed-in tariffs, production tax credits, and guaranteed annual returns on investments. They seek to claim the high moral ground, by chanting renewable"" while ignoring the environmental, economic and human costs of capturing and delivering energy from their preferred sources.""",OBJ,0_0
The concentration of carbon dioxide in the atmosphere has no effect on climate above 50 parts per million (ppm).,OBJ,2_3
